,adult,budget,id,origin_country,original_language,original_title,overview,popularity,release_date,revenue,runtime,spoken_languages,status,tagline,title,video,vote_average,vote_count,ingestion_date,genre,company,country
421,False,170000000,399579,['US'],en,Alita: Battle Angel,"When Alita awakens with no memory of who she is in a future world she does not recognize, she is taken in by Ido, a compassionate doctor who realizes that somewhere in this abandoned cyborg shell is the heart and soul of a young woman with an extraordinary past.",48.58575,2019-01-31,405000000,122,"[{'english_name': 'English', 'iso_639_1': 'en', 'name': 'English'}, {'english_name': 'Spanish', 'iso_639_1': 'es', 'name': 'Español'}]",Released,An angel falls. A warrior rises.,Alita: Battle Angel,False,7.236,9345,2025-03-24,Action,Troublemaker Studios,United States of America
422,False,0,1225767,['JP'],ja,蟲師 特別篇「日蝕む翳」,A strange shadow forms blocking the sun from a village following a solar eclipse. Ginko enlists the help of the villagers to solve the mystery of the shadow before it destroys their crops.,48.444625,2014-01-03,0,44,"[{'english_name': 'Japanese', 'iso_639_1': 'ja', 'name': '日本語'}]",Released,,Mushi-Shi: The Shadow That Devours the Sun,False,9.0,1,2025-03-24,Animation,,
423,False,58000000,293660,['US'],en,Deadpool,"The origin story of former Special Forces operative turned mercenary Wade Wilson, who, after being subjected to a rogue experiment that leaves him with accelerated healing powers, adopts the alter ego Deadpool. Armed with his new abilities and a dark, twisted sense of humor, Deadpool hunts down the man who nearly destroyed his life.",48.434,2016-02-09,782837347,108,"[{'english_name': 'English', 'iso_639_1': 'en', 'name': 'English'}]",Released,Feel the love.,Deadpool,False,7.6,31444,2025-03-24,Action,20th Century Fox,United States of America
424,False,0,704686,['SA'],ar,Dystopian Patterns,Something happened to that city. Could be Beirut.,48.295625,2021-10-19,0,6,[],Released,,Dystopian Patterns,False,0.0,0,2025-03-24,,,Belgium
425,False,550000,1287717,['PY'],es,No entres,"Two working class youtubers ‘in the making’ enter an abandoned mansion to get their basketball back, and get lost inside while pranking each other. They record their ‘quick adventure’ with their phones for their audience, and tweak it with a fake phantom appearance to attract more followers to their YouTube channel. When uploaded the video goes viral, so they start a challenge: if the video reaches a certain number of views, they will enter the house again, at night, alone, totally unprotected. As fans react positively, they will do as promised, not only to discover and unveil the true nature of the place and their inhabitants, but to realize they might not be among the living anymore. Which opens a question - how far would you go to be famous?",48.22425,2024-08-06,0,80,"[{'english_name': 'Guarani', 'iso_639_1': 'gn', 'name': ''}, {'english_name': 'Spanish', 'iso_639_1': 'es', 'name': 'Español'}]",Released,,Do Not Enter,False,7.0,134,2025-03-24,Horror,FilmSharks International,Argentina
426,False,0,21316,['US'],en,Leroy & Stitch,"Lilo, Stitch, Jumba, and Pleakley have finally caught all of Jumba's genetic experiments and found the one true place where each of them belongs. Stitch, Jumba and Pleakley are offered positions in the Galactic Alliance, turning them down so they can stay on Earth with Lilo, but Lilo realizes her alien friends have places where they belong – and it's finally time to say ""aloha"".",48.212875000000004,2006-06-23,0,73,"[{'english_name': 'English', 'iso_639_1': 'en', 'name': 'English'}]",Released,Here comes trouble!,Leroy & Stitch,False,6.5,534,2025-03-24,Animation,Disney Television Animation,United States of America
427,False,0,666632,['US'],en,Newtopia,"The adventurous Norwegian backpacker Audun Amundsen is driven by his search for a utopian world and ends up in the jungle of Indonesia. Here he meets the shaman Aman Paksa and his clan who lives a traditional life, surviving without money, electricity or modern tools. Amundsen follows Aman Paksa for nearly 15 years on his turbulent path towards modernity.",48.207625,2020-02-24,0,88,"[{'english_name': 'English', 'iso_639_1': 'en', 'name': 'English'}, {'english_name': 'Indonesian', 'iso_639_1': 'id', 'name': 'Bahasa indonesia'}]",Released,Why I helped the shaman buy a chainsaw,Newtopia,False,0.0,0,2025-03-24,Documentary,UpNorth Film,Norway
428,False,0,51482,['JP'],ja,DEATH NOTE リライト ～幻視する神～,"A recap of Death Note episodes 1–26, with new footage. When rogue shinigami Ryuk leaves his Death Note in the human world, he has no idea how far the one who finds it will take his new-found power. With the Death Note in hand, brilliant high school student Light Yagami vows to rid the world of evil.",48.16275,2007-08-31,0,131,"[{'english_name': 'Japanese', 'iso_639_1': 'ja', 'name': '日本語'}]",Released,,Death Note Relight 1: Visions of a God,False,7.9,355,2025-03-24,TV Movie,Madhouse,Japan
429,False,39000000,423108,['US'],en,The Conjuring: The Devil Made Me Do It,"Paranormal investigators Ed and Lorraine Warren encounter what would become one of the most sensational cases from their files. The fight for the soul of a young boy takes them beyond anything they'd ever seen before, to mark the first time in U.S. history that a murder suspect would claim demonic possession as a defense.",48.052,2021-05-25,206431050,111,"[{'english_name': 'English', 'iso_639_1': 'en', 'name': 'English'}, {'english_name': 'Portuguese', 'iso_639_1': 'pt', 'name': 'Português'}]",Released,The demonic case that shocked America.,The Conjuring: The Devil Made Me Do It,False,7.411,6002,2025-03-24,Horror,New Line Cinema,United States of America
430,False,1800000,592695,['SE'],sv,Pleasure,"19 year old Linnéa leaves her small town in Sweden and heads for Los Angeles with the aim of becoming the world's next big porn star, but the road to her goal turns out to be bumpier than she imagined.",47.967375000000004,2021-10-08,393824,108,"[{'english_name': 'English', 'iso_639_1': 'en', 'name': 'English'}, {'english_name': 'Swedish', 'iso_639_1': 'sv', 'name': 'svenska'}]",Released,"In the pursuit of fame, she discovers the price of pleasure.",Pleasure,False,6.224,598,2025-03-24,Drama,Film i Väst,France
431,False,185000000,414906,['US'],en,The Batman,"In his second year of fighting crime, Batman uncovers corruption in Gotham City that connects to his own family while facing a serial killer known as the Riddler.",65.98025,2022-03-01,772319315,177,"[{'english_name': 'English', 'iso_639_1': 'en', 'name': 'English'}]",Released,Unmask the truth.,The Batman,False,7.655,10744,2025-03-24,Crime,6th & Idaho Motion Picture Company,United States of America
432,False,165000000,753342,['US'],en,Napoleon,"An epic that details the checkered rise and fall of French Emperor Napoleon Bonaparte and his relentless journey to power through the prism of his addictive, volatile relationship with his wife, Josephine.",78.6695,2023-11-22,220597098,158,"[{'english_name': 'German', 'iso_639_1': 'de', 'name': 'Deutsch'}, {'english_name': 'English', 'iso_639_1': 'en', 'name': 'English'}, {'english_name': 'French', 'iso_639_1': 'fr', 'name': 'Français'}, {'english_name': 'Russian', 'iso_639_1': 'ru', 'name': 'Pусский'}]",Released,He came from nothing. He conquered everything.,Napoleon,False,6.356,2664,2025-03-24,History,Apple Studios,United States of America
433,False,165000000,10191,['US'],en,How to Train Your Dragon,"As the son of a Viking leader on the cusp of manhood, shy Hiccup Horrendous Haddock III faces a rite of passage: he must kill a dragon to prove his warrior mettle. But after downing a feared dragon, he realizes that he no longer wants to destroy it, and instead befriends the beast – which he names Toothless – much to the chagrin of his warrior father.",47.93475,2010-03-18,494879471,98,"[{'english_name': 'English', 'iso_639_1': 'en', 'name': 'English'}]",Released,One adventure will change two worlds,How to Train Your Dragon,False,7.8,13295,2025-03-24,Fantasy,DreamWorks Animation,United States of America
434,False,32000000,1109255,['IT'],it,Parthenope,"Parthenope, born in the sea near Naples in 1950, is beautiful, enigmatic, and intelligent. She is shamelessly courted by many. However, beauty comes at a cost.",79.764625,2024-10-19,10361110,137,"[{'english_name': 'English', 'iso_639_1': 'en', 'name': 'English'}, {'english_name': 'Italian', 'iso_639_1': 'it', 'name': 'Italiano'}]",Released,Is she a siren or a myth?,Parthenope,False,6.9,468,2025-03-24,Romance,The Apartment Pictures,France
435,False,30000000,615,['US'],en,The Passion of the Christ,A graphic portrayal of the last twelve hours of Jesus of Nazareth's life.,47.895624999999995,2004-02-25,612060372,127,"[{'english_name': 'Hebrew', 'iso_639_1': 'he', 'name': 'עִבְרִית'}, {'english_name': 'Latin', 'iso_639_1': 'la', 'name': 'Latin'}]",Released,"By his wounds, we were healed.",The Passion of the Christ,False,7.498,4680,2025-03-24,Drama,Icon Productions,United States of America
436,False,0,1114894,['US'],en,Star Trek: Section 31,Emperor Philippa Georgiou joins a secret division of Starfleet tasked with protecting the United Federation of Planets and faces the sins of her past.,83.69125,2025-01-15,0,96,"[{'english_name': 'English', 'iso_639_1': 'en', 'name': 'English'}]",Released,"To protect the light, they fight in shadow.",Star Trek: Section 31,False,4.841,236,2025-03-24,Science Fiction,Secret Hideout,United States of America
437,False,25000000,8681,['FR'],en,Taken,"Bryan Mills, a former government operative, is trying to reconnect with his teenage daughter Kim. After reluctantly agreeing with his ex-wife to let Kim go to Paris on vacation with a friend, his worst nightmare comes true. While on the phone with his daughter shortly after she arrives in Paris, she and her friend are abducted by a gang of human traffickers. Working against the clock, Bryan relies on his extensive training and skills to track down the ruthless gang that abducted her and launch a one-man war to rescue his daughter.",47.7465,2008-02-18,226830568,94,"[{'english_name': 'English', 'iso_639_1': 'en', 'name': 'English'}, {'english_name': 'French', 'iso_639_1': 'fr', 'name': 'Français'}, {'english_name': 'Arabic', 'iso_639_1': 'ar', 'name': 'العربية'}, {'english_name': 'Albanian', 'iso_639_1': 'sq', 'name': 'shqip'}]",Released,They took his daughter. He'll take their lives.,Taken,False,7.396,11403,2025-03-24,Action,EuropaCorp,France
438,False,6400000,218,['US'],en,The Terminator,"In the post-apocalyptic future, reigning tyrannical supercomputers teleport a cyborg assassin known as the ""Terminator"" back to 1984 to kill Sarah Connor, whose unborn son is destined to lead insurgents against 21st century mechanical hegemony. Meanwhile, the human-resistance movement dispatches a lone warrior to safeguard Sarah. Can he stop the virtually indestructible killing machine?",47.71975,1984-10-26,78371200,108,"[{'english_name': 'English', 'iso_639_1': 'en', 'name': 'English'}, {'english_name': 'Spanish', 'iso_639_1': 'es', 'name': 'Español'}]",Released,Your future is in its hands.,The Terminator,False,7.7,13452,2025-03-24,Action,Hemdale,United Kingdom
439,False,75000000,70160,['US'],en,The Hunger Games,"Every year in the ruins of what was once North America, the nation of Panem forces each of its twelve districts to send a teenage boy and girl to compete in the Hunger Games.  Part twisted entertainment, part government intimidation tactic, the Hunger Games are a nationally televised event in which “Tributes” must fight with one another until one survivor remains.  Pitted against highly-trained Tributes who have prepared for these Games their entire lives, Katniss is forced to rely upon her sharp instincts as well as the mentorship of drunken former victor Haymitch Abernathy.  If she’s ever to return home to District 12, Katniss must make impossible choices in the arena that weigh survival against humanity and life against love. The world will be watching.",47.670125,2012-03-12,694394724,142,"[{'english_name': 'English', 'iso_639_1': 'en', 'name': 'English'}]",Released,May the odds be ever in your favor.,The Hunger Games,False,7.2,22239,2025-03-24,Science Fiction,Lionsgate,United States of America
440,False,20000000,5492,['US'],en,Gunner,"While on a camping trip in order to reconnect, war veteran Colonel Lee Gunner must save his two sons from a gang of violent bikers when they're kidnapped after accidentally stumbling upon to a massive drug operation.",48.739625000000004,2024-08-16,0,90,"[{'english_name': 'English', 'iso_639_1': 'en', 'name': 'English'}]",Released,Vengeance has a new name.,Gunner,False,5.3,139,2025-03-24,Action,Convergence Entertainment,United States of America
441,False,0,1014505,['JP'],ja,劇場版「オーバーロード」聖王国編,"After twelve years of playing his favorite MMORPG game, Momonga logs in for the last time only to find himself transported into its world playing it indefinitely. Throughout his adventures, his avatar ascends to the title of Sorcerer King Ains Ooal Gown. Once prosperous but now on the brink of ruin, The Sacred Kingdom enjoyed years of peace after construction of an enormous wall protecting them from neighboring invasions. But, one day this comes to an end when the Demon Emperor Jaldabaoth arrives with an army of villainous demi-humans. Fearing invasion of their own lands, the neighboring territory of the Slane Theocracy is forced to beg their enemies at the Sorcerer Kingdom for help. Heeding the call, Momonga, now known as the Sorcerer King Ains Ooal Gown, rallies the Sorcerer Kingdom and its undead army to join the fight alongside the Sacred Kingdom and the Slane Theocracy in hopes to defeat the Demon Emperor.",48.63325,2024-09-20,7614966,134,"[{'english_name': 'Japanese', 'iso_639_1': 'ja', 'name': '日本語'}]",Released,,OVERLORD: The Sacred Kingdom,False,7.3,44,2025-03-24,Action,KADOKAWA,Japan
442,False,200000000,588228,['US'],en,The Tomorrow War,"The world is stunned when a group of time travelers arrive from the year 2051 to deliver an urgent message: Thirty years in the future, mankind is losing a global war against a deadly alien species. The only hope for survival is for soldiers and civilians from the present to be transported to the future and join the fight. Among those recruited is high school teacher and family man Dan Forester. Determined to save the world for his young daughter, Dan teams up with a brilliant scientist and his estranged father in a desperate quest to rewrite the fate of the planet.",48.626999999999995,2021-09-03,14400000,138,"[{'english_name': 'English', 'iso_639_1': 'en', 'name': 'English'}]",Released,The fight for tomorrow begins today.,The Tomorrow War,False,7.5,3621,2025-03-24,Action,Skydance Media,United States of America
443,False,0,99361,"['DE', 'CH']",de,Sechs Schwedinnen von der Tankstelle,A gas station becomes the center of social life in the village after six Swedish girls start working there.,48.589625,1980-09-19,0,85,"[{'english_name': 'Italian', 'iso_639_1': 'it', 'name': 'Italiano'}, {'english_name': 'German', 'iso_639_1': 'de', 'name': 'Deutsch'}]",Released,When Performance Counts... You Need High Test Girls. Their Body Work's the Best!,Six Swedish Girls at a Pump,False,6.333,21,2025-03-24,Comedy,,Switzerland
444,False,170000000,399579,['US'],en,Alita: Battle Angel,"When Alita awakens with no memory of who she is in a future world she does not recognize, she is taken in by Ido, a compassionate doctor who realizes that somewhere in this abandoned cyborg shell is the heart and soul of a young woman with an extraordinary past.",48.58575,2019-01-31,405000000,122,"[{'english_name': 'English', 'iso_639_1': 'en', 'name': 'English'}, {'english_name': 'Spanish', 'iso_639_1': 'es', 'name': 'Español'}]",Released,An angel falls. A warrior rises.,Alita: Battle Angel,False,7.236,9345,2025-03-24,Action,Troublemaker Studios,United States of America
445,False,125000000,746036,['US'],en,The Fall Guy,"Fresh off an almost career-ending accident, stuntman Colt Seavers has to track down a missing movie star, solve a conspiracy and try to win back the love of his life while still doing his day job.",48.472125,2024-04-24,181073291,127,"[{'english_name': 'English', 'iso_639_1': 'en', 'name': 'English'}]",Released,Fall hard.,The Fall Guy,False,7.035,2853,2025-03-24,Action,87North Productions,United States of America
446,False,0,1225767,['JP'],ja,蟲師 特別篇「日蝕む翳」,A strange shadow forms blocking the sun from a village following a solar eclipse. Ginko enlists the help of the villagers to solve the mystery of the shadow before it destroys their crops.,48.444625,2014-01-03,0,44,"[{'english_name': 'Japanese', 'iso_639_1': 'ja', 'name': '日本語'}]",Released,,Mushi-Shi: The Shadow That Devours the Sun,False,9.0,1,2025-03-24,Animation,,
447,False,58000000,293660,['US'],en,Deadpool,"The origin story of former Special Forces operative turned mercenary Wade Wilson, who, after being subjected to a rogue experiment that leaves him with accelerated healing powers, adopts the alter ego Deadpool. Armed with his new abilities and a dark, twisted sense of humor, Deadpool hunts down the man who nearly destroyed his life.",48.434,2016-02-09,782837347,108,"[{'english_name': 'English', 'iso_639_1': 'en', 'name': 'English'}]",Released,Feel the love.,Deadpool,False,7.6,31444,2025-03-24,Action,20th Century Fox,United States of America
448,False,0,704686,['SA'],ar,Dystopian Patterns,Something happened to that city. Could be Beirut.,48.295625,2021-10-19,0,6,[],Released,,Dystopian Patterns,False,0.0,0,2025-03-24,,,Belgium
449,False,550000,1287717,['PY'],es,No entres,"Two working class youtubers ‘in the making’ enter an abandoned mansion to get their basketball back, and get lost inside while pranking each other. They record their ‘quick adventure’ with their phones for their audience, and tweak it with a fake phantom appearance to attract more followers to their YouTube channel. When uploaded the video goes viral, so they start a challenge: if the video reaches a certain number of views, they will enter the house again, at night, alone, totally unprotected. As fans react positively, they will do as promised, not only to discover and unveil the true nature of the place and their inhabitants, but to realize they might not be among the living anymore. Which opens a question - how far would you go to be famous?",48.22425,2024-08-06,0,80,"[{'english_name': 'Guarani', 'iso_639_1': 'gn', 'name': ''}, {'english_name': 'Spanish', 'iso_639_1': 'es', 'name': 'Español'}]",Released,,Do Not Enter,False,7.0,134,2025-03-24,Horror,FilmSharks International,Argentina
450,False,0,21316,['US'],en,Leroy & Stitch,"Lilo, Stitch, Jumba, and Pleakley have finally caught all of Jumba's genetic experiments and found the one true place where each of them belongs. Stitch, Jumba and Pleakley are offered positions in the Galactic Alliance, turning them down so they can stay on Earth with Lilo, but Lilo realizes her alien friends have places where they belong – and it's finally time to say ""aloha"".",48.212875000000004,2006-06-23,0,73,"[{'english_name': 'English', 'iso_639_1': 'en', 'name': 'English'}]",Released,Here comes trouble!,Leroy & Stitch,False,6.5,534,2025-03-24,Animation,Disney Television Animation,United States of America
451,False,0,666632,['US'],en,Newtopia,"The adventurous Norwegian backpacker Audun Amundsen is driven by his search for a utopian world and ends up in the jungle of Indonesia. Here he meets the shaman Aman Paksa and his clan who lives a traditional life, surviving without money, electricity or modern tools. Amundsen follows Aman Paksa for nearly 15 years on his turbulent path towards modernity.",48.207625,2020-02-24,0,88,"[{'english_name': 'English', 'iso_639_1': 'en', 'name': 'English'}, {'english_name': 'Indonesian', 'iso_639_1': 'id', 'name': 'Bahasa indonesia'}]",Released,Why I helped the shaman buy a chainsaw,Newtopia,False,0.0,0,2025-03-24,Documentary,UpNorth Film,Norway
452,False,20000000,1100099,['GB'],en,We Live in Time,"An up-and-coming chef and a recent divorcée find their lives forever changed when a chance encounter brings them together, in a decade-spanning, deeply moving romance.",48.18075,2024-10-10,37182814,108,"[{'english_name': 'English', 'iso_639_1': 'en', 'name': 'English'}]",Released,Every minute counts.,We Live in Time,False,7.355,738,2025-03-24,Romance,Film4 Productions,United Kingdom
453,False,0,51482,['JP'],ja,DEATH NOTE リライト ～幻視する神～,"A recap of Death Note episodes 1–26, with new footage. When rogue shinigami Ryuk leaves his Death Note in the human world, he has no idea how far the one who finds it will take his new-found power. With the Death Note in hand, brilliant high school student Light Yagami vows to rid the world of evil.",48.16275,2007-08-31,0,131,"[{'english_name': 'Japanese', 'iso_639_1': 'ja', 'name': '日本語'}]",Released,,Death Note Relight 1: Visions of a God,False,7.9,355,2025-03-24,TV Movie,Madhouse,Japan
454,False,0,936621,['KR'],ko,물오징어6969,"Three married women had always been dissatisfied sexually with their husbands, and Hyoji, who recently divorced due to her husband's erectile dysfunction. They gathered after a long time and had a drink complaining to each other, and they received a business card from an unidentified handsome man, saying, ""Don't you want to play tteok pounding game?"" The four of them head to the meeting place and meet suspicious agents who were waiting for them.",48.05925,2022-01-27,0,74,"[{'english_name': 'Korean', 'iso_639_1': 'ko', 'name': '한국어/조선말'}]",Released,,Sex Game 6969,False,6.06,42,2025-03-24,Comedy,,South Korea
455,False,39000000,423108,['US'],en,The Conjuring: The Devil Made Me Do It,"Paranormal investigators Ed and Lorraine Warren encounter what would become one of the most sensational cases from their files. The fight for the soul of a young boy takes them beyond anything they'd ever seen before, to mark the first time in U.S. history that a murder suspect would claim demonic possession as a defense.",48.052,2021-05-25,206431050,111,"[{'english_name': 'English', 'iso_639_1': 'en', 'name': 'English'}, {'english_name': 'Portuguese', 'iso_639_1': 'pt', 'name': 'Português'}]",Released,The demonic case that shocked America.,The Conjuring: The Devil Made Me Do It,False,7.411,6002,2025-03-24,Horror,New Line Cinema,United States of America
456,False,1800000,592695,['SE'],sv,Pleasure,"19 year old Linnéa leaves her small town in Sweden and heads for Los Angeles with the aim of becoming the world's next big porn star, but the road to her goal turns out to be bumpier than she imagined.",47.967375000000004,2021-10-08,393824,108,"[{'english_name': 'English', 'iso_639_1': 'en', 'name': 'English'}, {'english_name': 'Swedish', 'iso_639_1': 'sv', 'name': 'svenska'}]",Released,"In the pursuit of fame, she discovers the price of pleasure.",Pleasure,False,6.224,598,2025-03-24,Drama,Film i Väst,France
457,False,165000000,10191,['US'],en,How to Train Your Dragon,"As the son of a Viking leader on the cusp of manhood, shy Hiccup Horrendous Haddock III faces a rite of passage: he must kill a dragon to prove his warrior mettle. But after downing a feared dragon, he realizes that he no longer wants to destroy it, and instead befriends the beast – which he names Toothless – much to the chagrin of his warrior father.",47.93475,2010-03-18,494879471,98,"[{'english_name': 'English', 'iso_639_1': 'en', 'name': 'English'}]",Released,One adventure will change two worlds,How to Train Your Dragon,False,7.8,13295,2025-03-24,Fantasy,DreamWorks Animation,United States of America
458,False,30000000,615,['US'],en,The Passion of the Christ,A graphic portrayal of the last twelve hours of Jesus of Nazareth's life.,47.895624999999995,2004-02-25,612060372,127,"[{'english_name': 'Hebrew', 'iso_639_1': 'he', 'name': 'עִבְרִית'}, {'english_name': 'Latin', 'iso_639_1': 'la', 'name': 'Latin'}]",Released,"By his wounds, we were healed.",The Passion of the Christ,False,7.498,4680,2025-03-24,Drama,Icon Productions,United States of America
459,False,25000000,8681,['FR'],en,Taken,"Bryan Mills, a former government operative, is trying to reconnect with his teenage daughter Kim. After reluctantly agreeing with his ex-wife to let Kim go to Paris on vacation with a friend, his worst nightmare comes true. While on the phone with his daughter shortly after she arrives in Paris, she and her friend are abducted by a gang of human traffickers. Working against the clock, Bryan relies on his extensive training and skills to track down the ruthless gang that abducted her and launch a one-man war to rescue his daughter.",47.7465,2008-02-18,226830568,94,"[{'english_name': 'English', 'iso_639_1': 'en', 'name': 'English'}, {'english_name': 'French', 'iso_639_1': 'fr', 'name': 'Français'}, {'english_name': 'Arabic', 'iso_639_1': 'ar', 'name': 'العربية'}, {'english_name': 'Albanian', 'iso_639_1': 'sq', 'name': 'shqip'}]",Released,They took his daughter. He'll take their lives.,Taken,False,7.396,11403,2025-03-24,Action,EuropaCorp,France
