,adult,budget,id,origin_country,original_language,original_title,overview,popularity,release_date,revenue,runtime,spoken_languages,status,tagline,title,video,vote_average,vote_count,ingestion_date,genre,company,country
0,False,0,1151470,['US'],en,The Vigilante,"Returning from Afghanistan, Jessica, a Spec OPS Marine, finds herself in a war she never imagined and discovers middle America suburbia has changed when her thirteen year old sister, Aimee, is abducted by sex traffickers.",1718.4861250000001,2023-09-08,0,100,"[{'english_name': 'English', 'iso_639_1': 'en', 'name': 'English'}]",Released,She will find you.,The Vigilante,False,5.85,20,2025-03-24,Thriller,Shattered Images Films,United States of America
1,False,0,1125899,['GB'],en,Cleaner,"When a group of radical activists take over an energy company's annual gala, seizing 300 hostages, an ex-soldier turned window cleaner suspended 50 storeys up on the outside of the building must save those trapped inside, including her younger brother.",1510.943375,2025-02-19,0,96,"[{'english_name': 'English', 'iso_639_1': 'en', 'name': 'English'}]",Released,The stakes are a thousand feet high.,Cleaner,False,5.8,46,2025-03-24,Action,Anton,United Kingdom
2,False,0,1301650,['MN'],mn,Z Zone,"In a remote corner of the world, a group of troubled youths finds themselves whisked away to a mysterious military base after a series of misbehaviors. Expecting little more than a stern reprimand, they are instead thrust into a world of secrets and shadows.  In a desperate bid for freedom, they must unravel the mysteries of the base and confront the sinister forces that lurk in the shadows. But with time running out and danger lurking around every corner, the odds of survival grow slimmer by the minute.  Courage, strength, and sacrifice, would they finally escape the clutches of the base and emerge from the darkness into the light?",1296.4256249999999,2025-02-07,0,83,"[{'english_name': 'Mongolian', 'iso_639_1': 'mn', 'name': ''}]",Released,,Z Zone,False,7.6,9,2025-03-24,Horror,,Mongolia
3,False,270000000,447273,['US'],en,Snow White,"Princess Snow White flees the castle when the Evil Queen, in her jealousy over Snow White's inner beauty, tries to kill her. Deep into the dark woods, she stumbles upon seven magical dwarves and a young thief named Jonathan. Together, they strive to survive the Queen's relentless pursuit and aspire to take back the kingdom in the process...",1114.221625,2025-03-19,87000000,109,"[{'english_name': 'English', 'iso_639_1': 'en', 'name': 'English'}, {'english_name': 'Spanish', 'iso_639_1': 'es', 'name': 'Español'}]",Released,The classic tale comes to life.,Snow White,False,4.664,256,2025-03-24,Family,Walt Disney Pictures,United States of America
4,False,180000000,822119,['US'],en,Captain America: Brave New World,"After meeting with newly elected U.S. President Thaddeus Ross, Sam finds himself in the middle of an international incident. He must discover the reason behind a nefarious global plot before the true mastermind has the entire world seeing red.",1794.8035,2025-02-12,400056272,119,"[{'english_name': 'English', 'iso_639_1': 'en', 'name': 'English'}, {'english_name': 'Japanese', 'iso_639_1': 'ja', 'name': '日本語'}, {'english_name': 'Spanish', 'iso_639_1': 'es', 'name': 'Español'}]",Released,The future favors the brave.,Captain America: Brave New World,False,6.1,1090,2025-03-24,Action,Marvel Studios,United States of America
5,False,320000000,777443,['US'],en,The Electric State,"An orphaned teen hits the road with a mysterious robot to find her long-lost brother, teaming up with a smuggler and his wisecracking sidekick.",932.4646250000001,2025-03-07,0,128,"[{'english_name': 'English', 'iso_639_1': 'en', 'name': 'English'}]",Released,Rage with the machines.,The Electric State,False,6.638,708,2025-03-24,Science Fiction,AGBO,United States of America
6,False,0,1297763,['US'],ja,ニンジャバットマン対ヤクザリーグ,"The Batman family has returned to the present to discover that Japan has disappeared, and a giant island - Hinomoto - is now in the sky over Gotham City.  At the top sit the Yakuza, a group of superpowered individuals who reign without honor or humanity and look suspiciously like the Justice League. Now, it’s up to Batman and his allies to save Gotham!",1222.743125,2025-03-17,0,90,"[{'english_name': 'Japanese', 'iso_639_1': 'ja', 'name': '日本語'}]",Released,,Batman Ninja vs. Yakuza League,False,6.7,56,2025-03-24,Animation,Kamikaze Douga,Japan
7,False,1100000,1217379,['TH'],en,Hellhound,"Ready to leave his profession behind, Loreno, an assassin, lends help to an old friend, Cetan, and taking one last job in Thailand seeking out a local kingpin. A lapse in judgment means Loreno crosses paths with old colleague Paul.",627.916375,2024-06-20,0,103,"[{'english_name': 'English', 'iso_639_1': 'en', 'name': 'English'}]",Released,Fight like a god. Die like a man.,Hellhound,False,6.136,22,2025-03-24,Action,,
8,False,0,1210938,['KR'],ko,계시록,A pastor who believes in divine revelation and a detective haunted by visions pursue a missing person case — exposing their own demons in the process.,594.7908749999999,2025-03-20,0,122,"[{'english_name': 'Korean', 'iso_639_1': 'ko', 'name': '한국어/조선말'}]",Released,"With twisted faith, madness begins.",Revelations,False,6.768,29,2025-03-24,Thriller,Wow Point,South Korea
9,False,0,1143407,['IN'],hi,स्काई फ़ोर्स,"In the 1965 Indo-Pak War, India faces a devastating surprise attack. Wing Commander Ahuja leads a retaliatory strike, but Squadron Leader Vijaya goes missing after a heroic solo engagement against a superior enemy jet. Ahuja spends 23 years seeking the truth and uncovering a cover-up.",546.703875,2025-01-24,0,125,"[{'english_name': 'English', 'iso_639_1': 'en', 'name': 'English'}, {'english_name': 'Hindi', 'iso_639_1': 'hi', 'name': 'हिन्दी'}]",Released,Some missions end. Others last a lifetime.,Sky Force,False,7.571,13,2025-03-24,Action,Maddock Films,India
10,False,150000000,1241982,['US'],en,Moana 2,"After receiving an unexpected call from her wayfinding ancestors, Moana journeys alongside Maui and a new crew to the far seas of Oceania and into dangerous, long-lost waters for an adventure unlike anything she's ever faced.",862.096125,2024-11-21,1056396565,99,"[{'english_name': 'English', 'iso_639_1': 'en', 'name': 'English'}]",Released,The ocean is calling them back.,Moana 2,False,7.1,2036,2025-03-24,Animation,Walt Disney Pictures,Canada
11,False,0,1077782,['US'],en,Old Guy,"Stuck at a dead end but vying for the love of spunky club manager Anata, aging contract killer Danny Dolinski is thrilled when The Company pulls him back in the field, but only to train Gen Z newcomer Wihlborg, a prodigy assassin with an attitude.",748.91275,2024-12-13,0,93,"[{'english_name': 'English', 'iso_639_1': 'en', 'name': 'English'}]",Released,Competition is always a killer.,Old Guy,False,5.3,47,2025-03-24,Action,23ten,United Kingdom
12,False,0,1356039,['MX'],es,Contraataque,"When a hostage rescue mission creates a new enemy, Capt. Guerrero and his elite soldiers must face an ambush by a criminal group.",817.12825,2025-02-27,0,85,"[{'english_name': 'Spanish', 'iso_639_1': 'es', 'name': 'Español'}]",Released,,Counterattack,False,8.493,523,2025-03-24,Action,Draco Films,Mexico
13,False,0,1362608,['FI'],fi,Pikku Siperia,"A pastor's faith turns upside down when a meteorite lands in his small Finnish town, its impact stirring up chaos and criminal intentions.",465.38487499999997,2025-03-20,0,105,"[{'english_name': 'Finnish', 'iso_639_1': 'fi', 'name': 'suomi'}]",Released,,Little Siberia,False,7.0,18,2025-03-24,Comedy,Bufo,Finland
14,False,0,995926,['KR'],ko,베테랑 2,"The veteran detective Seo Do-cheol and his team at Major Crimes, relentless in their pursuit of criminals, join forces with rookie cop Park Sun-woo to track down a serial killer who has plunged the nation into turmoil.",461.73325,2024-09-13,53453611,118,"[{'english_name': 'Korean', 'iso_639_1': 'ko', 'name': '한국어/조선말'}]",Released,Don't cross the line.,"I, the Executioner",False,7.0,45,2025-03-24,Action,Filmmaker R&K,South Korea
15,False,70000000,950396,['US'],en,The Gorge,"Two highly trained operatives grow close from a distance after being sent to guard opposite sides of a mysterious gorge. When an evil below emerges, they must work together to survive what lies within.",578.357625,2025-02-13,0,127,"[{'english_name': 'English', 'iso_639_1': 'en', 'name': 'English'}, {'english_name': 'Lithuanian', 'iso_639_1': 'lt', 'name': 'Lietuvių'}]",Released,The world's most dangerous secret lies between them.,The Gorge,False,7.7,2121,2025-03-24,Romance,Skydance Media,United States of America
16,False,25000000,1126166,['US'],en,Flight Risk,"A U.S. Marshal escorts a government witness to trial after he's accused of getting involved with a mob boss, only to discover that the pilot who is transporting them is also a hitman sent to assassinate the informant. After they subdue him, they're forced to fly together after discovering that there are others attempting to eliminate them.",655.685125,2025-01-22,40420193,91,"[{'english_name': 'English', 'iso_639_1': 'en', 'name': 'English'}]",Released,Y'all need a pilot?,Flight Risk,False,6.2,516,2025-03-24,Action,Davis Entertainment,United States of America
17,False,200000000,762509,['US'],en,Mufasa: The Lion King,"Mufasa, a cub lost and alone, meets a sympathetic lion named Taka, the heir to a royal bloodline. The chance meeting sets in motion an expansive journey of a group of misfits searching for their destiny.",634.4501250000001,2024-12-18,717197856,118,"[{'english_name': 'English', 'iso_639_1': 'en', 'name': 'English'}]",Released,The story of an orphan who would be king.,Mufasa: The Lion King,False,7.483,1695,2025-03-24,Adventure,Walt Disney Pictures,United States of America
18,False,0,1405338,['JP'],ja,Demon City 鬼ゴロシ,"Framed for his family's murder and left for dead, an ex-hitman will stop at nothing to exact revenge on the masked ""demons"" who have taken over his city.",577.71,2025-02-26,0,106,"[{'english_name': 'Hindi', 'iso_639_1': 'hi', 'name': 'हिन्दी'}, {'english_name': 'Japanese', 'iso_639_1': 'ja', 'name': '日本語'}]",Released,,Demon City,False,6.9,165,2025-03-24,Action,Netflix,Japan
19,False,0,1062276,['CA'],en,Dark Match,"A small-time wrestling company accepts a well-paying gig in a backwoods town only to learn, too late, that the community is run by a mysterious cult leader with devious plans for their match.",519.6165,2024-07-21,0,94,"[{'english_name': 'English', 'iso_639_1': 'en', 'name': 'English'}]",Released,,Dark Match,False,4.8,10,2025-03-24,Action,Dept.9 Studios,Canada
20,False,122000000,939243,['US'],en,Sonic the Hedgehog 3,"Sonic, Knuckles, and Tails reunite against a powerful new adversary, Shadow, a mysterious villain with powers unlike anything they have faced before. With their abilities outmatched in every way, Team Sonic must seek out an unlikely alliance in hopes of stopping Shadow and protecting the planet.",538.21475,2024-12-19,486018457,110,"[{'english_name': 'English', 'iso_639_1': 'en', 'name': 'English'}]",Released,New adventure. New rival.,Sonic the Hedgehog 3,False,7.8,2265,2025-03-24,Action,Paramount Pictures,United States of America
21,False,4350000,1064486,['AU'],en,Memoir of a Snail,"Forcibly separated from her twin brother when they are orphaned, a melancholic misfit learns how to find confidence within herself amid the clutter of misfortunes and everyday life.",330.457625,2024-10-17,2251196,94,"[{'english_name': 'English', 'iso_639_1': 'en', 'name': 'English'}, {'english_name': 'French', 'iso_639_1': 'fr', 'name': 'Français'}]",Released,"Life can only be understood backwards, but we have to live it forwards.",Memoir of a Snail,False,7.904,307,2025-03-24,Animation,Arenamedia,Australia
22,False,0,1145725,['US'],en,Tyler Perry's Duplicity,High-powered attorney Marley faces her most personal case yet when she is tasked with uncovering the truth behind the murder of her best friend Fela’s husband. With the help of her boyfriend – a former cop turned private investigator – Marley’s search for what really happened leads her down a treacherous maze of deception and betrayal.,398.33175,2025-03-19,0,109,"[{'english_name': 'English', 'iso_639_1': 'en', 'name': 'English'}]",Released,Justice isn't black and white.,Tyler Perry's Duplicity,False,6.9,47,2025-03-24,Thriller,Tyler Perry Studios,United States of America
23,False,3700000,823219,['LV'],lv,Straume,"A solitary cat, displaced by a great flood, finds refuge on a boat with various species and must navigate the challenges of adapting to a transformed world together.",311.142875,2024-08-29,17660107,85,"[{'english_name': 'No Language', 'iso_639_1': 'xx', 'name': 'No Language'}]",Released,,Flow,False,8.278,1631,2025-03-24,Animation,Dream Well Studio,Latvia
24,False,0,937393,['US'],en,Bloat,"After a near-death drowning accident, a young boy's family is horrified to discover he has become possessed by a legendary demon from the depths of the lake. As the family races against time to save the boy's soul, the evil monster inside the child tears the family apart as it seeks to destroy everyone in its path.",474.392375,2025-03-07,0,87,"[{'english_name': 'Japanese', 'iso_639_1': 'ja', 'name': '日本語'}, {'english_name': 'English', 'iso_639_1': 'en', 'name': 'English'}]",Released,,Bloat,False,3.95,10,2025-03-24,Horror,Pulsar Content,Japan
25,False,0,1286663,['US'],en,Control Freak,"A motivational speaker, plagued by an uncontrollable itch on her head, becomes infected with a parasitic demon from her homeland.",296.375,2025-03-13,0,104,"[{'english_name': 'English', 'iso_639_1': 'en', 'name': 'English'}]",Released,It's in your head.,Control Freak,False,5.8,29,2025-03-24,Horror,WorthenBrooks,United States of America
26,False,0,1230208,['FR'],fr,Bastion 36,"Forced out of his elite unit, a troubled cop launches his own rogue investigation when mysterious killings claim the lives of his former colleagues.",292.5105,2025-02-27,0,124,"[{'english_name': 'French', 'iso_639_1': 'fr', 'name': 'Français'}]",Released,,Squad 36,False,6.2,96,2025-03-24,Action,Gaumont,France
27,False,0,1075456,"['BR', 'US']",en,O'Dessa,"A farm girl is on an epic quest to recover a cherished family heirloom. Her journey leads her to a strange and dangerous city where she meets her one true love – but in order to save his soul, she must put the power of destiny and song to the ultimate test.",268.4005875,2025-03-08,0,106,"[{'english_name': 'English', 'iso_639_1': 'en', 'name': 'English'}]",Released,Ain’t nothing more powerful than love.,O'Dessa,False,6.385,39,2025-03-24,Music,Searchlight Pictures,Brazil
28,False,0,1357633,['JP'],ja,俺だけレベルアップな件 -ReAwakening-,"Over a decade after 'gates' connecting worlds appeared, awakening 'hunters' with superpowers, weakest hunter Sung Jinwoo encounters a double dungeon and accepts a mysterious quest, becoming the only one able to level up, changing his fate. A catch-up recap of the first season coupled with an exclusive sneak peek of the first two episodes of the highly anticipated second season in one momentous theatrical fan experience.",350.37987499999997,2024-11-26,6331827,116,"[{'english_name': 'Japanese', 'iso_639_1': 'ja', 'name': '日本語'}]",Released,,Solo Leveling -ReAwakening-,False,6.9,172,2025-03-24,Action,Aniplex,Japan
29,False,0,1104845,['US'],en,Plankton: The Movie,Plankton's tangled love story with his sentient computer wife goes sideways when she takes a stand — and decides to destroy the world without him.,358.126125,2025-03-08,0,83,"[{'english_name': 'English', 'iso_639_1': 'en', 'name': 'English'}]",Released,They needed a hero. They got a villain.,Plankton: The Movie,False,7.0,54,2025-03-24,Animation,Nickelodeon Movies,United States of America
30,False,18000000,1195506,['US'],en,Novocaine,"When the girl of his dreams is kidnapped, everyman Nate turns his inability to feel pain into an unexpected strength in his fight to get her back.",226.91699999999997,2025-03-12,10500000,109,"[{'english_name': 'English', 'iso_639_1': 'en', 'name': 'English'}]",Released,Nathan Caine can't feel pain.,Novocaine,False,7.4,57,2025-03-24,Action,Circle of Confusion,United States of America
31,False,21000000,927342,['IN'],ta,அமரன்,"A heroic true story of Major Mukund Varadarajan, an Indian Army officer who displayed extraordinary bravery during a counterterrorism mission in Kashmir’s Shopian district. The film captures his courage in protecting his nation and the devotion of his wife Indhu Rebecaa Varghese.",384.922125,2024-10-31,0,169,"[{'english_name': 'Tamil', 'iso_639_1': 'ta', 'name': 'தமிழ்'}]",Released,,Amaran,False,7.418,195,2025-03-24,Action,Raajkamal Films International,India
32,False,23800000,972533,['US'],en,Last Breath,Last Breath follows a seasoned deep-sea diver as he battles the raging elements to rescue his crewmate trapped hundreds of feet below the ocean's surface.,321.10525,2025-02-27,14875844,93,"[{'english_name': 'English', 'iso_639_1': 'en', 'name': 'English'}]",Released,Make every breath count.,Last Breath,False,6.068,74,2025-03-24,Thriller,Dark Castle Entertainment,United Kingdom
33,False,20000000,1249289,['US'],en,Alarum,"Two married spies caught in the crosshairs of an international intelligence network will stop at nothing to obtain a critical asset. Joe and Lara are agents living off the grid whose quiet retreat at a winter resort is blown to shreds when members of the old guard suspect the two may have joined an elite team of rogue spies, known as Alarum.",212.83225,2025-01-16,0,95,"[{'english_name': 'English', 'iso_639_1': 'en', 'name': 'English'}]",Released,One hell of a vacation.,Alarum,False,5.8,230,2025-03-24,Action,BondIt Media Capital,United States of America
34,False,0,1239481,['ES'],es,Raqa,"An enigmatic international spy in the service of Russia and a Spanish agent of Moroccan origin working for Europol coincide in the Syrian city of Raqqa, an enclave of the self-proclaimed Islamic State (ISIS). Both, despite being on opposite sides, have a common goal, to locate the whereabouts of one of the main leaders of the Jihad, known as The Jordan, to facilitate his elimination and precipitate the fall of the organization. In an atmosphere of mutual distrust, both will have to evade dangers, from summary executions to women sold into slavery.",256.090125,2024-11-22,0,101,"[{'english_name': 'English', 'iso_639_1': 'en', 'name': 'English'}, {'english_name': 'Arabic', 'iso_639_1': 'ar', 'name': 'العربية'}, {'english_name': 'Spanish', 'iso_639_1': 'es', 'name': 'Español'}]",Released,,Raqqa: Spy vs. Spy,False,5.5,3,2025-03-24,Thriller,Malika y el Saharaui A.I.E,Morocco
35,False,18000000,1035048,['US'],en,Elevation,A single father and two women venture from the safety of their homes to face monstrous creatures to save the life of a young boy.,189.270125,2024-11-07,3300000,91,"[{'english_name': 'English', 'iso_639_1': 'en', 'name': 'English'}]",Released,Don't go down without a fight.,Elevation,False,6.5,635,2025-03-24,Action,Lyrical Media,United States of America
36,False,10000000,1084199,['US'],en,Companion,"During a weekend getaway at a secluded lakeside estate, a group of friends finds themselves entangled in a web of secrets, deception, and advanced technology. As tensions rise and loyalties are tested, they uncover unsettling truths about themselves and the world around them.",289.7085,2025-01-22,36499858,97,"[{'english_name': 'German', 'iso_639_1': 'de', 'name': 'Deutsch'}, {'english_name': 'Mandarin', 'iso_639_1': 'zh', 'name': '普通话'}, {'english_name': 'Spanish', 'iso_639_1': 'es', 'name': 'Español'}, {'english_name': 'English', 'iso_639_1': 'en', 'name': 'English'}, {'english_name': 'Russian', 'iso_639_1': 'ru', 'name': 'Pусский'}]",Released,Find someone made just for you.,Companion,False,7.1,845,2025-03-24,Thriller,BoulderLight Pictures,United States of America
37,False,120000000,539972,['US'],en,Kraven the Hunter,"Kraven Kravinoff's complex relationship with his ruthless gangster father, Nikolai, starts him down a path of vengeance with brutal consequences, motivating him to become not only the greatest hunter in the world, but also one of its most feared.",350.06224999999995,2024-12-11,59184643,127,"[{'english_name': 'English', 'iso_639_1': 'en', 'name': 'English'}, {'english_name': 'Russian', 'iso_639_1': 'ru', 'name': 'Pусский'}, {'english_name': 'Turkish', 'iso_639_1': 'tr', 'name': 'Türkçe'}]",Released,Villains aren't born. They're made.,Kraven the Hunter,False,6.667,1457,2025-03-24,Action,Columbia Pictures,United States of America
38,False,0,617359,"['DE', 'IN']",bn,वृंदावानी वैराग्य,"Recalling memories of a friend who committed suicide, three lovers slowly slide into an anguish labyrinth of desire, loss and longing. They entangle in a colliding maze of forsaken loves, failed expectations and imperfect anticipations. A disintegrating web arises in which love exists, but as dispassionate yearning. Here affection is an indifferent desire that burns the soul to death.",163.915125,2018-05-01,0,91,"[{'english_name': 'Bengali', 'iso_639_1': 'bn', 'name': 'বাংলা'}]",Released,,Dispassionate Love,False,4.7,3,2025-03-24,Drama,Ashish Avikunthak Production,Germany
39,False,120000000,912649,['US'],en,Venom: The Last Dance,"Eddie and Venom are on the run. Hunted by both of their worlds and with the net closing in, the duo are forced into a devastating decision that will bring the curtains down on Venom and Eddie's last dance.",285.49375,2024-10-22,478103649,109,"[{'english_name': 'English', 'iso_639_1': 'en', 'name': 'English'}]",Released,'Til death do they part.,Venom: The Last Dance,False,6.792,3061,2025-03-24,Action,Columbia Pictures,United States of America
40,False,0,1160956,['CN'],zh,熊猫计划,"International action star Jackie Chan is invited to the adoption ceremony of a rare baby panda, but after an international crime syndicate attempts to kidnap the bear, Jackie has to save the bear using his stunt work skills.",300.49,2024-10-01,42333207,99,"[{'english_name': 'Arabic', 'iso_639_1': 'ar', 'name': 'العربية'}, {'english_name': 'Mandarin', 'iso_639_1': 'zh', 'name': '普通话'}, {'english_name': 'English', 'iso_639_1': 'en', 'name': 'English'}]",Released,,Panda Plan,False,7.05,160,2025-03-24,Action,Emei Film Studio,China
41,False,150000000,950387,['US'],en,A Minecraft Movie,"Four misfits find themselves struggling with ordinary problems when they are suddenly pulled through a mysterious portal into the Overworld: a bizarre, cubic wonderland that thrives on imagination. To get back home, they'll have to master this world while embarking on a magical quest with an unexpected, expert crafter, Steve.",179.085125,2025-04-02,0,101,"[{'english_name': 'English', 'iso_639_1': 'en', 'name': 'English'}]",Post Production,Be there and be square.,A Minecraft Movie,False,0.0,0,2025-03-24,Family,Warner Bros. Pictures,Sweden
42,False,0,1165464,['ES'],ca,Tú no eres yo,"After an absence of three years, Aitana makes a surprise return home with Gabi, her Brazilian partner, and their son. The reception from her parents is surprisingly cold. Only her wheelchair-bound brother is pleased to see her. But what affects Aitana most of all is the presence of a stranger her age sleeping in her bed, wearing her clothes, living in her house, and being treated by her parents as if she were their daughter. From that moment on, torn by jealousy, suspicion, and misunderstanding, Aitana tries to find out what is happening and who the intruder is until she discovers an unexpected and disturbing truth darker than she would ever have thought possible.",178.491625,2024-12-13,0,98,"[{'english_name': 'Catalan', 'iso_639_1': 'ca', 'name': 'Català'}, {'english_name': 'Spanish', 'iso_639_1': 'es', 'name': 'Español'}]",Released,We are all replaceable,You Are Not Me,False,7.0,1,2025-03-24,Drama,Proyecta Films,Spain
43,False,0,926670,['US'],en,Henry Danger: The Movie,"Henry Hart meets a superfan—eager to fight crime with Kid Danger—who comes into possession of a device that can open up alternate realities. Facing a wild ride, Henry will need his best friend Jasper and his new superfan sidekick to find his way out or be stuck in another dimension forever.",281.4205,2025-01-17,0,86,"[{'english_name': 'English', 'iso_639_1': 'en', 'name': 'English'}, {'english_name': 'Spanish', 'iso_639_1': 'es', 'name': 'Español'}]",Released,Danger... Like you've never seen before.,Henry Danger: The Movie,False,7.801,183,2025-03-24,Action,"Yes, Yes Coffee.",United States of America
44,False,18000000,1226406,['US'],en,Love Hurts,"A realtor is pulled back into the life he left behind after his former partner-in-crime resurfaces with an ominous message. With his crime-lord brother also on his trail, he must confront his past and the history he never fully buried.",297.36975,2025-02-06,16958671,83,"[{'english_name': 'English', 'iso_639_1': 'en', 'name': 'English'}]",Released,You can't break up with your past.,Love Hurts,False,6.0,125,2025-03-24,Action,87North Productions,United States of America
45,False,0,850920,['US'],en,The Parenting,"Boyfriends Josh and Rohan plan a weekend getaway to introduce their parents, only to discover that their rental is home to a 400-year-old poltergeist.",264.059125,2025-03-12,0,94,"[{'english_name': 'English', 'iso_639_1': 'en', 'name': 'English'}]",Released,Meeting the parents... it's a necessary evil.,The Parenting,False,5.8,58,2025-03-24,Horror,Good Fear,United States of America
