,adult,budget,id,origin_country,original_language,original_title,overview,popularity,release_date,revenue,runtime,spoken_languages,status,tagline,title,video,vote_average,vote_count,ingestion_date,genre,company,country
297,False,4400000,1064028,['US'],en,Subservience,"With his wife out sick, a struggling father brings home a lifelike AI, only to have his self-aware new help want everything her new family has to offer... Like the affection of her owner and she'll kill to get it.",61.51775000000001,2024-08-15,262793,105,"[{'english_name': 'English', 'iso_639_1': 'en', 'name': 'English'}]",Released,Don't turn her on.,Subservience,False,6.7,655,2025-03-24,Horror,Millennium Media,United States of America
298,False,0,1203329,"['PL', 'KR', 'US']",en,The Witcher: Sirens of the Deep,"Geralt of Rivia, a mutated monster hunter, is hired to investigate a series of attacks in a seaside village and finds himself drawn into a centuries-old conflict between humans and merpeople. He must count on friends — old and new — to solve the mystery before the hostilities between the two kingdoms escalate into an all-out war.",61.132374999999996,2025-02-10,0,92,"[{'english_name': 'English', 'iso_639_1': 'en', 'name': 'English'}]",Released,,The Witcher: Sirens of the Deep,False,7.0,153,2025-03-24,Animation,Studio Mir,Poland
299,False,165000000,10192,['US'],en,Shrek Forever After,"A bored and domesticated Shrek pacts with deal-maker Rumpelstiltskin to get back to feeling like a real ogre again, but when he's duped and sent to a twisted version of Far Far Away—where Rumpelstiltskin is king, ogres are hunted, and he and Fiona have never met—he sets out to restore his world and reclaim his true love.",60.946,2010-05-20,752600867,93,"[{'english_name': 'English', 'iso_639_1': 'en', 'name': 'English'}]",Released,It ain't ogre...til it's ogre.,Shrek Forever After,False,6.4,7475,2025-03-24,Comedy,DreamWorks Animation,United States of America
300,False,70000000,926393,['US'],en,The Equalizer 3,"Robert McCall finds himself at home in Southern Italy but he discovers his friends are under the control of local crime bosses. As events turn deadly, McCall knows what he has to do: become his friends' protector by taking on the mafia.",60.89975,2023-08-30,191067560,109,"[{'english_name': 'English', 'iso_639_1': 'en', 'name': 'English'}, {'english_name': 'Italian', 'iso_639_1': 'it', 'name': 'Italiano'}, {'english_name': 'Portuguese', 'iso_639_1': 'pt', 'name': 'Português'}]",Released,Justice knows no borders,The Equalizer 3,False,7.3,3196,2025-03-24,Action,Columbia Pictures,Italy
301,False,0,455968,['US'],en,Becoming Cary Grant,"For the first time one of Hollywood's greatest stars tells his own story, in his own words. From a childhood of poverty to global fame, Cary Grant, the ultimate self-made star, explores his own screen image and what it took to create it.",60.752125,2017-05-23,0,85,"[{'english_name': 'English', 'iso_639_1': 'en', 'name': 'English'}]",Released,His most challenging role was himself.,Becoming Cary Grant,False,6.6,40,2025-03-24,Documentary,YUZU Productions,France
302,False,150000000,135397,['US'],en,Jurassic World,"Twenty-two years after the events of Jurassic Park, Isla Nublar now features a fully functioning dinosaur theme park, Jurassic World, as originally envisioned by John Hammond.",60.6545,2015-06-06,1671537444,124,"[{'english_name': 'English', 'iso_639_1': 'en', 'name': 'English'}]",Released,The park is open.,Jurassic World,False,6.7,20589,2025-03-24,Action,Amblin Entertainment,United States of America
303,False,115000000,585,['US'],en,"Monsters, Inc.","Lovable Sulley and his wisecracking sidekick Mike Wazowski are the top scare team at Monsters, Inc., the scream-processing factory in Monstropolis. When a little girl named Boo wanders into their world, it's the monsters who are scared silly, and it's up to Sulley and Mike to keep her out of sight and get her back home.",60.5605,2001-11-01,579700000,92,"[{'english_name': 'English', 'iso_639_1': 'en', 'name': 'English'}]",Released,We scare because we care.,"Monsters, Inc.",False,7.8,18732,2025-03-24,Animation,Pixar,United States of America
304,False,35000000,346364,['US'],en,It,"In a small town in Maine, seven children known as The Losers Club come face to face with life problems, bullies and a monster that takes the shape of a clown called Pennywise.",60.1205,2017-09-06,703000000,135,"[{'english_name': 'English', 'iso_639_1': 'en', 'name': 'English'}]",Released,You'll float too.,It,False,7.239,19250,2025-03-24,Horror,New Line Cinema,United States of America
305,False,200000000,337404,['US'],en,Cruella,"In 1970s London amidst the punk rock revolution, a young grifter named Estella is determined to make a name for herself with her designs. She befriends a pair of young thieves who appreciate her appetite for mischief, and together they are able to build a life for themselves on the London streets. One day, Estella’s flair for fashion catches the eye of the Baroness von Hellman, a fashion legend who is devastatingly chic and terrifyingly haute. But their relationship sets in motion a course of events and revelations that will cause Estella to embrace her wicked side and become the raucous, fashionable and revenge-bent Cruella.",60.0595,2021-05-26,233503234,134,"[{'english_name': 'English', 'iso_639_1': 'en', 'name': 'English'}, {'english_name': 'French', 'iso_639_1': 'fr', 'name': 'Français'}]",Released,Hello Cruel World,Cruella,False,8.0,9503,2025-03-24,Comedy,Walt Disney Pictures,United States of America
306,False,14000000,1280672,['US'],en,One of Them Days,"Best friends and roommates Dreux and Alyssa are about to have One of Them Days. When they discover Alyssa’s boyfriend has blown their rent money, the duo finds themselves going to extremes in a comical race against the clock to avoid eviction and keep their friendship intact.",59.789874999999995,2025-01-16,48765616,97,"[{'english_name': 'English', 'iso_639_1': 'en', 'name': 'English'}]",Released,,One of Them Days,False,6.8,95,2025-03-24,Comedy,TriStar Pictures,United States of America
307,False,150000000,675,['GB'],en,Harry Potter and the Order of the Phoenix,"Returning for his fifth year of study at Hogwarts, Harry is stunned to find that his warnings about the return of Lord Voldemort have been ignored. Left with no choice, Harry takes matters into his own hands, training a small group of students to defend themselves against the dark arts.",59.772499999999994,2007-07-08,938212738,138,"[{'english_name': 'English', 'iso_639_1': 'en', 'name': 'English'}]",Released,The rebellion begins.,Harry Potter and the Order of the Phoenix,False,7.675,19772,2025-03-24,Adventure,Warner Bros. Pictures,United Kingdom
308,False,0,1159311,['JP'],ja,僕のヒーローアカデミア THE MOVIE ユアネクスト,"In a society devastated by the effects of an all-out war between heroes and villains, a mysterious giant fortress suddenly appears, engulfing towns and people one after another. Then, a man reminiscent of All Might, the 'symbol of peace', stands in front of Izuku and his friends...",59.385625,2024-08-02,32224616,110,"[{'english_name': 'Japanese', 'iso_639_1': 'ja', 'name': '日本語'}]",Released,Next up is you.,My Hero Academia: You're Next,False,6.8,100,2025-03-24,Animation,BONES,Japan
309,False,0,1322121,['KR'],ko,위험한 동거,"Woo-seong, a freelance translator, relieves stress by having sex with his sex partner, Ji-yeong, whenever things get stuck at work. Ji-yeong provides Woo-seong with a new type of sex every time. One day, Woo-seong meets his college senior, Cheol-min, and is invited to come to his house. He learns there that his former lover, Hye-ran, is now his senior's wife. Woo-seong awkwardly calls Hye-ran her sister-in-law, and together with his current girlfriend, Mi-jin, the two couples drink and have a good time. The following day, Cheol-min leaves for work. That evening, Woo-seong and Hye-ran resolved a misunderstanding from their past and ended up having sex. However, they are caught by Mi-jin, so she decides to seduce Cheol-min as revenge. From that day on, the four met occasionally and enjoyed swapping partners.",59.37325,2020-03-06,0,76,"[{'english_name': 'Korean', 'iso_639_1': 'ko', 'name': '한국어/조선말'}]",Released,"It's thrilling, different, and bold!",Dangerous Cohabitation,False,0.0,0,2025-03-24,Drama,,South Korea
310,False,0,995803,['US'],en,Arena Wars,"In 2045 convicted criminals are given the opportunity to compete on the world's #1 televised sporting event, Arena Wars. They must survive 7 rooms and 7 of the most vicious killers in the country. If they win, they regain their freedom.",59.367875,2024-06-25,0,96,"[{'english_name': 'English', 'iso_639_1': 'en', 'name': 'English'}]",Released,The only way to live...is to kill.,Arena Wars,False,5.0,48,2025-03-24,Action,Mahal Empire,United States of America
311,False,90000000,863,['US'],en,Toy Story 2,"Andy heads off to Cowboy Camp, leaving his toys to their own devices. Things shift into high gear when an obsessive toy collector named Al McWhiggen, owner of Al's Toy Barn kidnaps Woody. Andy's toys mount a daring rescue mission, Buzz Lightyear meets his match and Woody has to decide where he and his heart truly belong.",59.3405,1999-10-30,497375381,92,"[{'english_name': 'English', 'iso_639_1': 'en', 'name': 'English'}]",Released,The toys are back!,Toy Story 2,False,7.596,14056,2025-03-24,Animation,Pixar,United States of America
312,False,45000000,1013601,['US'],en,The Alto Knights,"Two of New York's most notorious organized crime bosses, Frank Costello and Vito Genovese, vie for control of the city's streets. Once the best of friends, petty jealousies and a series of betrayals place them on a deadly collision course that will reshape the Mafia (and America) forever.",59.20925,2025-03-14,5065000,123,"[{'english_name': 'English', 'iso_639_1': 'en', 'name': 'English'}]",Released,The most dangerous enemy is an old friend.,The Alto Knights,False,6.284,38,2025-03-24,Drama,Warner Bros. Pictures,United States of America
313,False,46000000,146233,['US'],en,Prisoners,"Keller Dover is facing every parent’s worst nightmare. His six-year-old daughter, Anna, is missing, together with her young friend, Joy, and as minutes turn to hours, panic sets in. The only lead is a dilapidated RV that had earlier been parked on their street.",58.892875000000004,2013-09-19,122126687,153,"[{'english_name': 'English', 'iso_639_1': 'en', 'name': 'English'}]",Released,Every moment matters.,Prisoners,False,8.099,12049,2025-03-24,Drama,Alcon Entertainment,United States of America
314,False,0,105397,['HK'],cn,滅門慘案II：借種,"Another gruesome case involving a woman who's a sole survivor of a brutal massacre. A local constable questions the woman about her whereabouts and what might have happened the night before. As he gets the young woman to talk, she spins a tale of debauchery, madness and people so vile that you wished that they'll never see daylight again. Why is this woman so reluctant to talk? Who else might be involved in this ghastly murder? How will this bumbling cop get any solid leads or useful clues from this shell shocked woman?",58.892624999999995,1994-01-01,0,98,"[{'english_name': 'Cantonese', 'iso_639_1': 'cn', 'name': '广州话 / 廣州話'}]",Released,,Daughter of Darkness 2,False,5.6,21,2025-03-24,Comedy,Mandarin Star Films,Hong Kong
315,False,0,1276945,['BE'],nl,Ferry 2,"After losing his drug empire, Ferry Bouman has found a measure of peace away from Brabant's criminal underworld — until his past catches up to him.",58.838375,2024-12-19,0,94,"[{'english_name': 'Dutch', 'iso_639_1': 'nl', 'name': 'Nederlands'}]",Released,,Ferry 2,False,5.7,108,2025-03-24,Action,De Mensen,Belgium
316,False,116000000,335983,['US'],en,Venom,"Investigative journalist Eddie Brock attempts a comeback following a scandal, but accidentally becomes the host of Venom, a violent, super powerful alien symbiote. Soon, he must rely on his newfound powers to protect the world from a shadowy organization looking for a symbiote of their own.",58.808625,2018-09-28,856085151,112,"[{'english_name': 'Mandarin', 'iso_639_1': 'zh', 'name': '普通话'}, {'english_name': 'English', 'iso_639_1': 'en', 'name': 'English'}, {'english_name': 'Malay', 'iso_639_1': 'ms', 'name': 'Bahasa melayu'}]",Released,The world has enough Superheroes.,Venom,False,6.828,16431,2025-03-24,Science Fiction,Matt Tolmach Productions,China
317,False,35000000,18785,['US'],en,The Hangover,"When three friends finally come to after a raucous night of bachelor-party revelry, they find a baby in the closet and a tiger in the bathroom. But they can't seem to locate their best friend, Doug – who's supposed to be tying the knot. Launching a frantic search for Doug, the trio perseveres through a nasty hangover to try to make it to the church on time.",58.751625,2009-06-02,469310836,100,"[{'english_name': 'English', 'iso_639_1': 'en', 'name': 'English'}]",Released,Some guys just can't handle Vegas.,The Hangover,False,7.3,17130,2025-03-24,Comedy,Legendary Pictures,United States of America
318,False,0,195223,['FR'],fr,Cérémonie d'amour,"Hugo, a vain clothing buyer, meets Myriam on a train and pursues a relationship with her. He is delighted to learn she is a prostitute and has no idea she has more in mind than Hugo bargained for.",58.745374999999996,1987-07-19,0,100,"[{'english_name': 'French', 'iso_639_1': 'fr', 'name': 'Français'}]",Released,,Love Rites,False,4.6,16,2025-03-24,Drama,,France
319,False,94000000,12,['US'],en,Finding Nemo,"Nemo, an adventurous young clownfish, is unexpectedly taken from his Great Barrier Reef home to a dentist's office aquarium. It's up to his worrisome father Marlin and a friendly but forgetful fish Dory to bring Nemo home -- meeting vegetarian sharks, surfer dude turtles, hypnotic jellyfish, hungry seagulls, and more along the way.",58.625875,2003-05-30,940335536,100,"[{'english_name': 'English', 'iso_639_1': 'en', 'name': 'English'}]",Released,There are 3.7 trillion fish in the ocean. They're looking for one.,Finding Nemo,False,7.817,19535,2025-03-24,Animation,Pixar,United States of America
320,False,29000000,11036,['US'],en,The Notebook,"An epic love story centered around an older man who reads aloud to a woman with Alzheimer's. From a faded notebook, the old man's words bring to life the story about a couple who is separated by World War II, and is then passionately reunited, seven years later, after they have taken different paths.",58.5985,2004-05-25,115600000,123,"[{'english_name': 'English', 'iso_639_1': 'en', 'name': 'English'}]",Released,Behind every great love is a great story.,The Notebook,False,7.89,11766,2025-03-24,Romance,New Line Cinema,United States of America
321,False,55000000,475557,['US'],en,Joker,"During the 1980s, a failed stand-up comedian is driven insane and turns to a life of crime and chaos in Gotham City while becoming an infamous psychopathic crime figure.",58.46675,2019-10-01,1078958629,122,"[{'english_name': 'English', 'iso_639_1': 'en', 'name': 'English'}]",Released,Put on a happy face.,Joker,False,8.1,26245,2025-03-24,Crime,Warner Bros. Pictures,Canada
322,False,40000000,637649,['US'],en,Wrath of Man,"A cold and mysterious new security guard for a Los Angeles cash truck company surprises his co-workers when he unleashes precision skills during a heist. The crew is left wondering who he is and where he came from. Soon, the marksman's ultimate motive becomes clear as he takes dramatic and irrevocable steps to settle a score.",58.41475,2021-04-22,103966489,118,"[{'english_name': 'English', 'iso_639_1': 'en', 'name': 'English'}]",Released,A Dark Spirit.,Wrath of Man,False,7.624,5505,2025-03-24,Action,Miramax,United Kingdom
323,False,365000000,99861,['US'],en,Avengers: Age of Ultron,"When Tony Stark tries to jumpstart a dormant peacekeeping program, things go awry and Earth’s Mightiest Heroes are put to the ultimate test as the fate of the planet hangs in the balance. As the villainous Ultron emerges, it is up to The Avengers to stop him from enacting his terrible plans, and soon uneasy alliances and unexpected action pave the way for an epic and unique global adventure.",58.30475,2015-04-22,1405403694,141,"[{'english_name': 'English', 'iso_639_1': 'en', 'name': 'English'}]",Released,A new age has come.,Avengers: Age of Ultron,False,7.3,23309,2025-03-24,Action,Marvel Studios,United States of America
324,False,14500000,678512,['US'],en,Sound of Freedom,"The story of Tim Ballard, a former US government agent, who quits his job in order to devote his life to rescuing children from global sex traffickers.",58.148,2023-07-03,250600000,131,"[{'english_name': 'English', 'iso_639_1': 'en', 'name': 'English'}, {'english_name': 'Spanish', 'iso_639_1': 'es', 'name': 'Español'}]",Released,Fight for the light. Silence the darkness.,Sound of Freedom,False,8.0,2502,2025-03-24,Action,Santa Fe Films,United States of America
325,False,8000000,170,['GB'],en,28 Days Later,"Twenty-eight days after a killer virus was accidentally unleashed from a British research facility, a small group of London survivors are caught in a desperate struggle to protect themselves from the infected. Carried by animals and humans, the virus turns those it infects into homicidal maniacs -- and it's absolutely impossible to contain.",58.123000000000005,2002-10-31,84661434,113,"[{'english_name': 'Spanish', 'iso_639_1': 'es', 'name': 'Español'}, {'english_name': 'English', 'iso_639_1': 'en', 'name': 'English'}]",Released,His fear began when he woke up alone. His terror began when he realised he wasn't.,28 Days Later,False,7.2,6997,2025-03-24,Horror,DNA Films,United Kingdom
326,False,37000000,8966,['US'],en,Twilight,"When Bella Swan moves to a small town in the Pacific Northwest, she falls in love with Edward Cullen, a mysterious classmate who reveals himself to be a 108-year-old vampire. Despite Edward's repeated cautions, Bella can't stay away from him, a fatal move that endangers her own life.",58.01775000000001,2008-11-20,393616788,122,"[{'english_name': 'English', 'iso_639_1': 'en', 'name': 'English'}]",Released,"When you can live forever, what do you live for?",Twilight,False,6.3,13715,2025-03-24,Fantasy,Summit Entertainment,United Kingdom
327,False,500000,1079485,['GB'],en,Winnie-the-Pooh: Blood and Honey 2,"Five months following the murders, Christopher Robin struggles to maintain a regular life while dealing with PTSD. However, deep within the 100-Acre-Wood, a destructive rage grows as Pooh, Piglet, Owl, and Tigger find their home and their lives endangered after their existence is revealed.",57.942499999999995,2024-03-26,7582541,93,"[{'english_name': 'English', 'iso_639_1': 'en', 'name': 'English'}]",Released,Friends will gather to take revenge.,Winnie-the-Pooh: Blood and Honey 2,False,6.0,345,2025-03-24,Horror,Jagged Edge Productions,United Kingdom
328,False,0,1147710,['KR'],ko,하이재킹,"Pilots Tae-in and Gyu-sik are set to fly to Gimpo. Under the guidance of flight attendant Ok-soon, passengers are busy boarding. However, shortly after takeoff, a homemade bomb explodes, turning the cabin into chaos.",57.92337500000001,2024-06-21,14602614,100,"[{'english_name': 'Korean', 'iso_639_1': 'ko', 'name': '한국어/조선말'}]",Released,One passenger with a different destination.,Hijack 1971,False,6.4,99,2025-03-24,Action,Perfect Storm Film,South Korea
329,False,300000000,285,['US'],en,Pirates of the Caribbean: At World's End,"Will Turner and Elizabeth Swann join forces with the revived Captain Barbossa to free Jack Sparrow from Davy Jones' locker. The group must navigate dangerous waters, confront many foes and, ultimately, choose sides in a battle wherein piracy itself hangs in the balance.",57.437875,2007-05-19,961691209,169,"[{'english_name': 'English', 'iso_639_1': 'en', 'name': 'English'}]",Released,"At the end of the world, the adventure begins.",Pirates of the Caribbean: At World's End,False,7.3,14599,2025-03-24,Adventure,Jerry Bruckheimer Films,United States of America
330,False,140000000,1726,['US'],en,Iron Man,"After being held captive in an Afghan cave, billionaire engineer Tony Stark creates a unique weaponized suit of armor to fight evil.",57.3825,2008-04-30,585174222,126,"[{'english_name': 'English', 'iso_639_1': 'en', 'name': 'English'}, {'english_name': 'Persian', 'iso_639_1': 'fa', 'name': 'فارسی'}, {'english_name': 'Urdu', 'iso_639_1': 'ur', 'name': 'اردو'}, {'english_name': 'Arabic', 'iso_639_1': 'ar', 'name': 'العربية'}]",Released,Heroes aren't born. They're built.,Iron Man,False,7.648,26775,2025-03-24,Action,Marvel Studios,United States of America
331,False,250000000,767,['GB'],en,Harry Potter and the Half-Blood Prince,"As Lord Voldemort tightens his grip on both the Muggle and wizarding worlds, Hogwarts is no longer a safe haven. Harry suspects perils may even lie within the castle, but Dumbledore is more intent upon preparing him for the final battle fast approaching. Together they work to find the key to unlock Voldemorts defenses and to this end, Dumbledore recruits his old friend and colleague Horace Slughorn, whom he believes holds crucial information. Even as the decisive showdown looms, romance blossoms for Harry, Ron, Hermione and their classmates. Love is in the air, but danger lies ahead and Hogwarts may never be the same again.",57.335375,2009-07-15,933959197,153,"[{'english_name': 'English', 'iso_639_1': 'en', 'name': 'English'}]",Released,Dark secrets revealed.,Harry Potter and the Half-Blood Prince,False,7.684,19762,2025-03-24,Adventure,Warner Bros. Pictures,United Kingdom
332,False,150000000,2062,['US'],en,Ratatouille,"Remy, a resident of Paris, appreciates good food and has quite a sophisticated palate. He would love to become a chef so he can create and enjoy culinary masterpieces to his heart's delight. The only problem is, Remy is a rat. When he winds up in the sewer beneath one of Paris' finest restaurants, the rodent gourmet finds himself ideally placed to realize his dream.",57.22275,2007-06-28,623726000,111,"[{'english_name': 'English', 'iso_639_1': 'en', 'name': 'English'}, {'english_name': 'Danish', 'iso_639_1': 'da', 'name': 'Dansk'}, {'english_name': 'French', 'iso_639_1': 'fr', 'name': 'Français'}]",Released,He's dying to become a chef.,Ratatouille,False,7.825,17364,2025-03-24,Animation,Pixar,United States of America
333,False,0,1299652,['US'],en,Watchmen: Chapter II,"Suspicious of the events ensnaring their former colleagues, Nite Owl and Silk Spectre are spurred out of retirement to investigate. As they grapple with personal ethics, inner demons and a society turned against them, they race the clock to uncover a deepening plot that might trigger global nuclear war.",57.21925,2024-11-25,0,89,"[{'english_name': 'English', 'iso_639_1': 'en', 'name': 'English'}]",Released,,Watchmen: Chapter II,False,7.5,96,2025-03-24,Animation,Warner Bros. Animation,United States of America
334,False,11000000,348,['US'],en,Alien,"During its return to the earth, commercial spaceship Nostromo intercepts a distress signal from a distant planet. When a three-member team of the crew discovers a chamber containing thousands of eggs on the planet, a creature inside one of the eggs attacks an explorer. The entire crew is unaware of the impending nightmare set to descend upon them when the alien parasite planted inside its unfortunate host is birthed.",56.941374999999994,1979-05-25,104931801,117,"[{'english_name': 'English', 'iso_639_1': 'en', 'name': 'English'}, {'english_name': 'Spanish', 'iso_639_1': 'es', 'name': 'Español'}]",Released,"In space, no one can hear you scream.",Alien,False,8.2,15139,2025-03-24,Horror,20th Century Fox,United States of America
335,False,90000000,10674,['US'],en,Mulan,"To save her father from certain death in the army, a young woman secretly enlists in his place and becomes one of China's greatest heroines in the process.",56.92875000000001,1998-06-18,304320254,88,"[{'english_name': 'English', 'iso_639_1': 'en', 'name': 'English'}, {'english_name': 'Mandarin', 'iso_639_1': 'zh', 'name': '普通话'}]",Released,THE FLOWER THAT BLOOMS IN ADVERSITY IS THE MOST RARE AND BEAUTIFUL OF ALL.,Mulan,False,7.905,9854,2025-03-24,Animation,Walt Disney Pictures,United States of America
336,False,0,1395724,['JP'],ja,痴人の愛,"Kawai Joji, an aspiring screenwriter who has won a screenplay competition but has yet to make his professional debut, meets a beautiful woman, Naomi, in a rundown bar one day. Naomi says she is working at the bar while aiming to become an actress. On another day, Joji is asked by his screenplay instructor if he would like to write a screenplay for a film based on Tanizaki Junichiro's ""A Fool's Love"" on his behalf. Joji is determined to succeed this time, but struggles to write the script. Meanwhile, Joji meets Naomi again, and the two of them quickly become closer, but...",56.899125,2024-11-29,0,106,"[{'english_name': 'Japanese', 'iso_639_1': 'ja', 'name': '日本語'}]",Released,,Chijin no Ai,False,6.0,1,2025-03-24,Drama,Legend Pictures,Japan
337,False,0,1129598,['US'],en,Prey,A young couple is compelled to leave their Christian missionary station in the Kalahari Desert after being threatened with death by an extremist militant gang. After crashing their aircraft they must battle man and beast for their lives.,56.8545,2024-03-15,0,86,"[{'english_name': 'English', 'iso_639_1': 'en', 'name': 'English'}, {'english_name': 'Spanish', 'iso_639_1': 'es', 'name': 'Español'}]",Released,Let the hunt begin.,Prey,False,6.2,309,2025-03-24,Action,The Barnum Picture Company,United States of America
