,adult,budget,id,origin_country,original_language,original_title,overview,popularity,release_date,revenue,runtime,spoken_languages,status,tagline,title,video,vote_average,vote_count,ingestion_date,genre,company,country
175,False,1488423,408,['US'],en,Snow White and the Seven Dwarfs,"A beautiful girl, Snow White, takes refuge in the forest in the house of seven dwarfs to hide from her stepmother, the wicked Queen. The Queen is jealous because she wants to be known as ""the fairest in the land,"" and Snow White's beauty surpasses her own.",89.91187500000001,1938-01-14,184925486,83,"[{'english_name': 'English', 'iso_639_1': 'en', 'name': 'English'}]",Released,"The Happiest, Dopiest, Grumpiest, Sneeziest movie of the year.",Snow White and the Seven Dwarfs,False,7.1,7529,2025-03-24,Fantasy,Walt Disney Productions,United States of America
176,False,14500000,978796,['US'],en,Bagman,"For centuries and across cultures, parents have warned their children of the legendary Bagman, who snatches innocent children and stuffs them into his vile, rotting bag—never to be seen again. Patrick McKee narrowly escaped such an encounter as a boy, which left him with lasting scars throughout his adulthood. Now, Patrick’s childhood tormentor has returned, threatening the safety of his wife Karina and son Jake.",89.743375,2024-09-20,0,92,"[{'english_name': 'English', 'iso_639_1': 'en', 'name': 'English'}]",Released,He's always closer than you think.,Bagman,False,6.296,280,2025-03-24,Horror,Lionsgate,United States of America
177,False,356000000,299534,['US'],en,Avengers: Endgame,"After the devastating events of Avengers: Infinity War, the universe is in ruins due to the efforts of the Mad Titan, Thanos. With the help of remaining allies, the Avengers must assemble once more in order to undo Thanos' actions and restore order to the universe once and for all, no matter what consequences may be in store.",89.46912499999999,2019-04-24,2799439100,181,"[{'english_name': 'English', 'iso_639_1': 'en', 'name': 'English'}, {'english_name': 'Japanese', 'iso_639_1': 'ja', 'name': '日本語'}, {'english_name': 'Xhosa', 'iso_639_1': 'xh', 'name': ''}]",Released,Avenge the fallen.,Avengers: Endgame,False,8.238,26155,2025-03-24,Adventure,Marvel Studios,United States of America
178,False,160000000,653346,['US'],en,Kingdom of the Planet of the Apes,"Several generations following Caesar's reign, apes – now the dominant species – live harmoniously while humans have been reduced to living in the shadows. As a new tyrannical ape leader builds his empire, one young ape undertakes a harrowing journey that will cause him to question all he's known about the past and to make choices that will define a future for apes and humans alike.",88.52525,2024-05-08,397378150,145,"[{'english_name': 'English', 'iso_639_1': 'en', 'name': 'English'}]",Released,No one can stop the reign.,Kingdom of the Planet of the Apes,False,7.1,3629,2025-03-24,Science Fiction,20th Century Studios,United States of America
179,False,0,1222064,"['DK', 'GB']",en,River of Blood,Four kayakers take the wrong river into a jungle inhabited by a tribe of merciless cannibals.,88.27825,2024-08-29,0,86,"[{'english_name': 'English', 'iso_639_1': 'en', 'name': 'English'}]",Released,,River of Blood,False,6.2,41,2025-03-24,Horror,REinvent Studios,Denmark
180,False,200000000,634649,['US'],en,Spider-Man: No Way Home,"Peter Parker is unmasked and no longer able to separate his normal life from the high-stakes of being a super-hero. When he asks for help from Doctor Strange the stakes become even more dangerous, forcing him to discover what it truly means to be Spider-Man.",77.662125,2021-12-15,1921847111,148,"[{'english_name': 'English', 'iso_639_1': 'en', 'name': 'English'}, {'english_name': 'Tagalog', 'iso_639_1': 'tl', 'name': ''}]",Released,Enter the Multiverse.,Spider-Man: No Way Home,False,7.948,20612,2025-03-24,Action,Marvel Studios,United States of America
181,False,0,653794,['US'],en,Victoria,Wordless animated fim from Robert Sahakyants,84.34700000000001,1997-12-05,0,6,"[{'english_name': 'Armenian', 'iso_639_1': 'hy', 'name': ''}]",Released,,Victoria,False,0.0,0,2025-03-24,Animation,Armenfilm,Armenia
182,False,165000000,438631,['US'],en,Dune,"Paul Atreides, a brilliant and gifted young man born into a great destiny beyond his understanding, must travel to the most dangerous planet in the universe to ensure the future of his family and his people. As malevolent forces explode into conflict over the planet's exclusive supply of the most precious resource in existence-a commodity capable of unlocking humanity's greatest potential-only those who can conquer their fear will survive.",71.497,2021-09-15,407573628,155,"[{'english_name': 'Mandarin', 'iso_639_1': 'zh', 'name': '普通话'}, {'english_name': 'English', 'iso_639_1': 'en', 'name': 'English'}]",Released,It begins.,Dune,False,7.782,13335,2025-03-24,Science Fiction,Legendary Pictures,United States of America
183,False,1480000,1000837,['BR'],pt,Ainda Estou Aqui,"In 1971, military dictatorship in Brazil reaches its height. The Paiva family — Rubens, Eunice, and their five children — live in a beachside house in Rio, open to all their friends. One day, Rubens is taken for questioning and does not return.",88.19825,2024-09-19,29940623,138,"[{'english_name': 'Portuguese', 'iso_639_1': 'pt', 'name': 'Português'}]",Released,"When a mother's courage defies tyranny, hope is reborn.",I'm Still Here,False,7.959,528,2025-03-24,Drama,VideoFilmes,Brazil
184,False,30000000,1032823,['US'],en,Trap,"A father and teen daughter attend a pop concert, where they realize they're at the center of a dark and sinister event.",56.129125,2024-07-31,82677281,105,"[{'english_name': 'English', 'iso_639_1': 'en', 'name': 'English'}]",Released,"30,000 fans. 300 cops. 1 serial killer. No escape.",Trap,False,6.4,2036,2025-03-24,Crime,Blinding Edge Pictures,United States of America
185,False,175000000,354912,['US'],en,Coco,"Despite his family’s baffling generations-old ban on music, Miguel dreams of becoming an accomplished musician like his idol, Ernesto de la Cruz. Desperate to prove his talent, Miguel finds himself in the stunning and colorful Land of the Dead following a mysterious chain of events. Along the way, he meets charming trickster Hector, and together, they set off on an extraordinary journey to unlock the real story behind Miguel's family history.",91.72025,2017-10-27,807816196,105,"[{'english_name': 'English', 'iso_639_1': 'en', 'name': 'English'}, {'english_name': 'Spanish', 'iso_639_1': 'es', 'name': 'Español'}]",Released,The celebration of a lifetime.,Coco,False,8.204,19831,2025-03-24,Family,Pixar,United States of America
186,False,200000000,597,['US'],en,Titanic,"101-year-old Rose DeWitt Bukater tells the story of her life aboard the Titanic, 84 years later. A young Rose boards the ship with her mother and fiancé. Meanwhile, Jack Dawson and Fabrizio De Rossi win third-class tickets aboard the ship. Rose tells the whole story from Titanic's departure through to its death—on its first and last voyage—on April 15, 1912.",80.238375,1997-11-18,2264162353,194,"[{'english_name': 'English', 'iso_639_1': 'en', 'name': 'English'}, {'english_name': 'French', 'iso_639_1': 'fr', 'name': 'Français'}, {'english_name': 'German', 'iso_639_1': 'de', 'name': 'Deutsch'}, {'english_name': 'Swedish', 'iso_639_1': 'sv', 'name': 'svenska'}, {'english_name': 'Italian', 'iso_639_1': 'it', 'name': 'Italiano'}, {'english_name': 'Russian', 'iso_639_1': 'ru', 'name': 'Pусский'}]",Released,Nothing on Earth could come between them.,Titanic,False,7.906,25809,2025-03-24,Drama,Paramount Pictures,United States of America
187,False,15000000,1114513,['US'],en,Speak No Evil,"When an American family is invited to spend the weekend at the idyllic country estate of a charming British family they befriended on vacation, what begins as a dream holiday soon warps into a snarled psychological nightmare.",96.37125,2024-09-11,76756109,110,"[{'english_name': 'English', 'iso_639_1': 'en', 'name': 'English'}]",Released,,Speak No Evil,False,7.264,1353,2025-03-24,Horror,Blumhouse Productions,United States of America
188,False,20000000,1097549,['US'],en,Babygirl,A high-powered CEO puts her career and family on the line when she begins a torrid affair with her much younger intern.,91.843875,2024-12-25,60934894,115,"[{'english_name': 'English', 'iso_639_1': 'en', 'name': 'English'}]",Released,Get exactly what you want.,Babygirl,False,5.823,575,2025-03-24,Drama,A24,United States of America
189,False,150000000,277834,['US'],en,Moana,"In Ancient Polynesia, when a terrible curse incurred by Maui reaches an impetuous Chieftain's daughter's island, she answers the Ocean's call to seek out the demigod to set things right.",79.409375,2016-10-13,690860472,107,"[{'english_name': 'English', 'iso_639_1': 'en', 'name': 'English'}]",Released,The ocean is calling.,Moana,False,7.566,12958,2025-03-24,Adventure,Walt Disney Pictures,United States of America
190,False,79000000,121,['US'],en,The Lord of the Rings: The Two Towers,"Frodo Baggins and the other members of the Fellowship continue on their sacred quest to destroy the One Ring--but on separate paths. Their destinies lie at two towers--Orthanc Tower in Isengard, where the corrupt wizard Saruman awaits, and Sauron's fortress at Barad-dur, deep within the dark lands of Mordor. Frodo and Sam are trekking to Mordor to destroy the One Ring of Power while Gimli, Legolas and Aragorn search for the orc-captured Merry and Pippin. All along, nefarious wizard Saruman awaits the Fellowship members at the Orthanc Tower in Isengard.",74.917125,2002-12-18,926287400,179,"[{'english_name': 'English', 'iso_639_1': 'en', 'name': 'English'}]",Released,The fellowship is broken. The power of darkness grows...,The Lord of the Rings: The Two Towers,False,8.401,22384,2025-03-24,Adventure,New Line Cinema,New Zealand
191,False,291000000,575264,['US'],en,Mission: Impossible - Dead Reckoning Part One,"Ethan Hunt and his IMF team embark on their most dangerous mission yet: To track down a terrifying new weapon that threatens all of humanity before it falls into the wrong hands. With control of the future and the world's fate at stake and dark forces from Ethan's past closing in, a deadly race around the globe begins. Confronted by a mysterious, all-powerful enemy, Ethan must consider that nothing can matter more than his mission—not even the lives of those he cares about most.",64.289625,2023-07-08,567535383,164,"[{'english_name': 'French', 'iso_639_1': 'fr', 'name': 'Français'}, {'english_name': 'English', 'iso_639_1': 'en', 'name': 'English'}, {'english_name': 'Italian', 'iso_639_1': 'it', 'name': 'Italiano'}, {'english_name': 'Russian', 'iso_639_1': 'ru', 'name': 'Pусский'}]",Released,We all share the same fate.,Mission: Impossible - Dead Reckoning Part One,False,7.531,4096,2025-03-24,Action,Paramount Pictures,United States of America
192,False,0,1127767,['US'],en,Riff Raff,A retired hitman's life is turned upside down when his ex-wife and son arrive unannounced during the holidays because they are on the run from his former mob associates.,54.868750000000006,2025-02-27,901370,103,"[{'english_name': 'English', 'iso_639_1': 'en', 'name': 'English'}]",Released,Crime is a family affair.,Riff Raff,False,6.0,15,2025-03-24,Comedy,Signature Films,United States of America
193,False,18000000,85,['US'],en,Raiders of the Lost Ark,"When Dr. Indiana Jones – the tweed-suited professor who just happens to be a celebrated archaeologist – is hired by the government to locate the legendary Ark of the Covenant, he finds himself up against the entire Nazi regime.",82.86275,1981-06-12,389925971,115,"[{'english_name': 'English', 'iso_639_1': 'en', 'name': 'English'}, {'english_name': 'Spanish', 'iso_639_1': 'es', 'name': 'Español'}, {'english_name': 'German', 'iso_639_1': 'de', 'name': 'Deutsch'}, {'english_name': 'Hebrew', 'iso_639_1': 'he', 'name': 'עִבְרִית'}, {'english_name': 'Arabic', 'iso_639_1': 'ar', 'name': 'العربية'}, {'english_name': 'Nepali', 'iso_639_1': 'ne', 'name': ''}]",Released,The return of the great adventure.,Raiders of the Lost Ark,False,7.9,12749,2025-03-24,Adventure,Paramount Pictures,United States of America
194,False,90000000,603692,['US'],en,John Wick: Chapter 4,"With the price on his head ever increasing, John Wick uncovers a path to defeating The High Table. But before he can earn his freedom, Wick must face off against a new enemy with powerful alliances across the globe and forces that turn old friends into foes.",78.85900000000001,2023-03-22,440157245,170,"[{'english_name': 'Arabic', 'iso_639_1': 'ar', 'name': 'العربية'}, {'english_name': 'Cantonese', 'iso_639_1': 'cn', 'name': '广州话 / 廣州話'}, {'english_name': 'English', 'iso_639_1': 'en', 'name': 'English'}, {'english_name': 'French', 'iso_639_1': 'fr', 'name': 'Français'}, {'english_name': 'German', 'iso_639_1': 'de', 'name': 'Deutsch'}, {'english_name': 'Japanese', 'iso_639_1': 'ja', 'name': '日本語'}, {'english_name': 'Latin', 'iso_639_1': 'la', 'name': 'Latin'}, {'english_name': 'Russian', 'iso_639_1': 'ru', 'name': 'Pусский'}, {'english_name': 'Spanish', 'iso_639_1': 'es', 'name': 'Español'}]",Released,"No way back, one way out.",John Wick: Chapter 4,False,7.7,6914,2025-03-24,Action,Thunder Road,Germany
195,False,150000000,809,['US'],en,Shrek 2,"Shrek, Fiona, and Donkey set off to Far, Far Away to meet Fiona's mother and father, the Queen and King. But not everyone is happily ever after. Shrek and the King find it difficult to get along, and there's tension in the marriage. The Fairy Godmother discovers that Fiona has married Shrek instead of her son Prince Charming and plots to destroy their marriage.",80.998125,2004-05-19,935454538,92,"[{'english_name': 'English', 'iso_639_1': 'en', 'name': 'English'}]",Released,What happens after happily ever after?,Shrek 2,False,7.288,12559,2025-03-24,Animation,DreamWorks Animation,United States of America
196,False,160000000,27205,"['US', 'GB']",en,Inception,"Cobb, a skilled thief who commits corporate espionage by infiltrating the subconscious of his targets is offered a chance to regain his old life as payment for a task considered to be impossible: ""inception"", the implantation of another person's idea into a target's subconscious.",74.9675,2010-07-15,839030630,148,"[{'english_name': 'English', 'iso_639_1': 'en', 'name': 'English'}, {'english_name': 'French', 'iso_639_1': 'fr', 'name': 'Français'}, {'english_name': 'Japanese', 'iso_639_1': 'ja', 'name': '日本語'}, {'english_name': 'Swahili', 'iso_639_1': 'sw', 'name': 'Kiswahili'}]",Released,Your mind is the scene of the crime.,Inception,False,8.4,37221,2025-03-24,Action,Legendary Pictures,United Kingdom
197,False,0,1056648,"['CH', 'FR']",fr,Le Procès du Chien,"April, an idealistic lawyer dedicated to lost causes, agrees to defend Cosmos, a dog that has bitten three people, leading to the first canine trial. She has no choice but to win the case, as otherwise, her unusual client will be put down.",96.81762499999999,2024-09-11,0,80,"[{'english_name': 'French', 'iso_639_1': 'fr', 'name': 'Français'}]",Released,,Dog on Trial,False,6.2,38,2025-03-24,Comedy,Atelier de Production,France
198,False,0,1388366,['US'],en,Popeye the Slayer Man,"A curious group of friends sneak into an abandoned spinach canning factory to film a documentary on the legend of the ""Sailor Man,"" who is said to haunt the factory and local docks.",53.14475,2025-03-21,0,88,"[{'english_name': 'English', 'iso_639_1': 'en', 'name': 'English'}]",Released,He is what he is.,Popeye the Slayer Man,False,4.5,2,2025-03-24,Horror,Millman Productions,United States of America
199,False,120000000,920,['US'],en,Cars,"Lightning McQueen, a hotshot rookie race car driven to succeed, discovers that life is about the journey, not the finish line, when he finds himself unexpectedly detoured in the sleepy Route 66 town of Radiator Springs. On route across the country to the big Piston Cup Championship in California to compete against two seasoned pros, McQueen gets to know the town's offbeat characters.",84.0635,2006-06-08,461983149,117,"[{'english_name': 'English', 'iso_639_1': 'en', 'name': 'English'}, {'english_name': 'Italian', 'iso_639_1': 'it', 'name': 'Italiano'}, {'english_name': 'Japanese', 'iso_639_1': 'ja', 'name': '日本語'}, {'english_name': 'Yiddish', 'iso_639_1': 'yi', 'name': ''}]",Released,Ahhh... it's got that new movie smell.,Cars,False,7.0,14221,2025-03-24,Animation,Pixar,United States of America
200,False,50000000,957452,['US'],en,The Crow,"Soulmates Eric and Shelly are brutally murdered when the demons of her dark past catch up with them. Given the chance to save his true love by sacrificing himself, Eric sets out to seek merciless revenge on their killers, traversing the worlds of the living and the dead to put the wrong things right.",79.852125,2024-08-21,24109036,111,"[{'english_name': 'English', 'iso_639_1': 'en', 'name': 'English'}]",Released,True love never dies.,The Crow,False,5.835,991,2025-03-24,Action,Davis Films,France
201,False,60000000,14836,['US'],en,Coraline,"Wandering her rambling old house in her boring new town, 11-year-old Coraline discovers a hidden door to a strangely idealized version of her life. In order to stay in the fantasy, she must make a frighteningly real sacrifice.",79.81875,2009-02-05,185860104,100,"[{'english_name': 'English', 'iso_639_1': 'en', 'name': 'English'}, {'english_name': 'Spanish', 'iso_639_1': 'es', 'name': 'Español'}]",Released,Be careful what you wish for.,Coraline,False,7.889,8287,2025-03-24,Animation,Laika,United States of America
202,False,32000000,1109255,['IT'],it,Parthenope,"Parthenope, born in the sea near Naples in 1950, is beautiful, enigmatic, and intelligent. She is shamelessly courted by many. However, beauty comes at a cost.",79.764625,2024-10-19,10361110,137,"[{'english_name': 'English', 'iso_639_1': 'en', 'name': 'English'}, {'english_name': 'Italian', 'iso_639_1': 'it', 'name': 'Italiano'}]",Released,Is she a siren or a myth?,Parthenope,False,6.9,468,2025-03-24,Romance,The Apartment Pictures,France
203,False,150000000,277834,['US'],en,Moana,"In Ancient Polynesia, when a terrible curse incurred by Maui reaches an impetuous Chieftain's daughter's island, she answers the Ocean's call to seek out the demigod to set things right.",79.409375,2016-10-13,690860472,107,"[{'english_name': 'English', 'iso_639_1': 'en', 'name': 'English'}]",Released,The ocean is calling.,Moana,False,7.566,12958,2025-03-24,Adventure,Walt Disney Pictures,United States of America
204,False,150000000,823464,['US'],en,Godzilla x Kong: The New Empire,"Following their explosive showdown, Godzilla and Kong must reunite against a colossal undiscovered threat hidden within our world, challenging their very existence – and our own.",79.144125,2024-03-27,571750016,115,"[{'english_name': 'English', 'iso_639_1': 'en', 'name': 'English'}]",Released,Rise together or fall alone.,Godzilla x Kong: The New Empire,False,7.101,4104,2025-03-24,Action,Legendary Pictures,United States of America
205,False,0,1403735,['IN'],te,లైలా,"Sonu Model, a renowned beautician from the old city, is forced to disguise himself as Laila, leading to a series of comedic, romantic, and action-packed events. Chaos ensues in this hilarious laugh riot",79.01775,2025-02-14,0,134,"[{'english_name': 'Telugu', 'iso_639_1': 'te', 'name': 'తెలుగు'}]",Released,,Laila,False,0.0,0,2025-03-24,Comedy,Shine Screens,India
206,False,90000000,603692,['US'],en,John Wick: Chapter 4,"With the price on his head ever increasing, John Wick uncovers a path to defeating The High Table. But before he can earn his freedom, Wick must face off against a new enemy with powerful alliances across the globe and forces that turn old friends into foes.",78.85900000000001,2023-03-22,440157245,170,"[{'english_name': 'Arabic', 'iso_639_1': 'ar', 'name': 'العربية'}, {'english_name': 'Cantonese', 'iso_639_1': 'cn', 'name': '广州话 / 廣州話'}, {'english_name': 'English', 'iso_639_1': 'en', 'name': 'English'}, {'english_name': 'French', 'iso_639_1': 'fr', 'name': 'Français'}, {'english_name': 'German', 'iso_639_1': 'de', 'name': 'Deutsch'}, {'english_name': 'Japanese', 'iso_639_1': 'ja', 'name': '日本語'}, {'english_name': 'Latin', 'iso_639_1': 'la', 'name': 'Latin'}, {'english_name': 'Russian', 'iso_639_1': 'ru', 'name': 'Pусский'}, {'english_name': 'Spanish', 'iso_639_1': 'es', 'name': 'Español'}]",Released,"No way back, one way out.",John Wick: Chapter 4,False,7.7,6914,2025-03-24,Action,Thunder Road,Germany
207,False,5270000,1196470,['FR'],fr,Survivre,A couple celebrates their son’s birthday in the middle of the ocean on their boat. A violent storm hits and it brings up hungry creatures from the depths and they fight for their survival.,78.79675,2024-06-19,0,90,"[{'english_name': 'French', 'iso_639_1': 'fr', 'name': 'Français'}]",Released,The world has gone sideways.,Survive,False,5.9,174,2025-03-24,Science Fiction,M.E.S. Productions,France
208,False,35000000,866398,['US'],en,The Beekeeper,One man's campaign for vengeance takes on national stakes after he is revealed to be a former operative of a powerful and clandestine organization known as Beekeepers.,78.682,2024-01-08,152720535,105,"[{'english_name': 'English', 'iso_639_1': 'en', 'name': 'English'}]",Released,Expose the corruption. Protect the hive.,The Beekeeper,False,7.331,3432,2025-03-24,Action,Miramax,United Kingdom
209,False,165000000,753342,['US'],en,Napoleon,"An epic that details the checkered rise and fall of French Emperor Napoleon Bonaparte and his relentless journey to power through the prism of his addictive, volatile relationship with his wife, Josephine.",78.6695,2023-11-22,220597098,158,"[{'english_name': 'German', 'iso_639_1': 'de', 'name': 'Deutsch'}, {'english_name': 'English', 'iso_639_1': 'en', 'name': 'English'}, {'english_name': 'French', 'iso_639_1': 'fr', 'name': 'Français'}, {'english_name': 'Russian', 'iso_639_1': 'ru', 'name': 'Pусский'}]",Released,He came from nothing. He conquered everything.,Napoleon,False,6.356,2664,2025-03-24,History,Apple Studios,United States of America
210,False,40000000,604685,['US'],en,Den of Thieves 2: Pantera,"Big Nick is back on the hunt in Europe and closing in on Donnie, who is embroiled in the treacherous and unpredictable world of diamond thieves and the infamous Panther mafia, as they plot a massive heist of the world's largest diamond exchange.",78.466125,2025-01-08,54586117,144,"[{'english_name': 'English', 'iso_639_1': 'en', 'name': 'English'}]",Released,The score isn't settled.,Den of Thieves 2: Pantera,False,6.8,349,2025-03-24,Action,Diamond Film Productions,Canada
211,False,60000000,748783,"['US', 'GB']",en,The Garfield Movie,"Garfield, the world-famous, Monday-hating, lasagna-loving indoor cat, is about to have a wild outdoor adventure! After an unexpected reunion with his long-lost father – scruffy street cat Vic – Garfield and his canine friend Odie are forced from their perfectly pampered life into joining Vic in a hilarious, high-stakes heist.",78.12412499999999,2024-04-30,254907482,100,"[{'english_name': 'English', 'iso_639_1': 'en', 'name': 'English'}]",Released,Indoor cat. Outdoor adventure.,The Garfield Movie,False,7.072,1232,2025-03-24,Animation,Alcon Entertainment,Hong Kong
212,False,200000000,634649,['US'],en,Spider-Man: No Way Home,"Peter Parker is unmasked and no longer able to separate his normal life from the high-stakes of being a super-hero. When he asks for help from Doctor Strange the stakes become even more dangerous, forcing him to discover what it truly means to be Spider-Man.",77.662125,2021-12-15,1921847111,148,"[{'english_name': 'English', 'iso_639_1': 'en', 'name': 'English'}, {'english_name': 'Tagalog', 'iso_639_1': 'tl', 'name': ''}]",Released,Enter the Multiverse.,Spider-Man: No Way Home,False,7.948,20612,2025-03-24,Action,Marvel Studios,United States of America
213,False,0,222761,['US'],en,Tropic of Desire,"A male hustler drifts into Key West, where he becomes involved in a series of steamy interludes with disreputable locals intertwined in various political intrigues.",77.035875,1979-06-15,0,87,"[{'english_name': 'English', 'iso_639_1': 'en', 'name': 'English'}]",Released,Every man has a price and his is paid by the hour.,Tropic of Desire,False,6.8,3,2025-03-24,Drama,Butterflies Ltd. Productions,United States of America
214,False,110000000,675353,['US'],en,Sonic the Hedgehog 2,"After settling in Green Hills, Sonic is eager to prove he has what it takes to be a true hero. His test comes when Dr. Robotnik returns, this time with a new partner, Knuckles, in search for an emerald that has the power to destroy civilizations. Sonic teams up with his own sidekick, Tails, and together they embark on a globe-trotting journey to find the emerald before it falls into the wrong hands.",76.95712499999999,2022-03-30,405421518,123,"[{'english_name': 'English', 'iso_639_1': 'en', 'name': 'English'}]",Released,Welcome to the next level.,Sonic the Hedgehog 2,False,7.474,5409,2025-03-24,Action,Original Film,Japan
215,False,11500000,1182387,['US'],en,Armor,"Armored truck security guard James Brody is working with his son Casey transporting millions of dollars between banks when a team of thieves led by Rook orchestrate a takeover of their truck to seize the riches. Following a violent car chase, Rook soon has the armored truck surrounded and James and Casey find themselves cornered onto a decrepit bridge.",76.94,2024-10-30,0,89,"[{'english_name': 'English', 'iso_639_1': 'en', 'name': 'English'}, {'english_name': 'Russian', 'iso_639_1': 'ru', 'name': 'Pусский'}]",Released,On the bridge of death.,Armor,False,5.6,187,2025-03-24,Action,Convergence Entertainment,United States of America
